title,score,id,url,comms_num,created,body,timestamp,upvote_ratio,author,subreddit,permalink,is_original_content,over_18,spoiler,locked,stickied
"Elon has transcended time, space, and county regulations",80652,ghw12u,https://i.redd.it/frcjfc2967y41.jpg,4812,1589229677.0,,2020-05-12 05:41:17,0.9,DC_Swamp_Thing,wallstreetbets,/r/wallstreetbets/comments/ghw12u/elon_has_transcended_time_space_and_county/,False,False,False,False,False
Times Square right now,493788,l8rf4k,https://v.redd.it/x64z70f7eie61,14112,1612029638.0,,2021-01-31 03:00:38,0.99,SomeGuyInDeutschland,wallstreetbets,/r/wallstreetbets/comments/l8rf4k/times_square_right_now/,False,False,False,False,False
UPVOTE so everyone sees we got SUPPORT,339488,l6wu59,https://i.redd.it/sgoqy8nyt2e61.png,12806,1611841234.0,,2021-01-28 22:40:34,0.98,vrweensy,wallstreetbets,/r/wallstreetbets/comments/l6wu59/upvote_so_everyone_sees_we_got_support/,False,False,False,False,False
GME YOLO update — Jan 28 2021,301826,l78uct,https://i.redd.it/opzucppb15e61.png,22925,1611867983.0,,2021-01-29 06:06:23,0.98,DeepFuckingValue,wallstreetbets,/r/wallstreetbets/comments/l78uct/gme_yolo_update_jan_28_2021/,False,False,False,False,False
GME YOLO month-end update — Jan 2021,265526,l846a1,https://i.redd.it/r557em3t5ce61.png,19833,1611954285.0,,2021-01-30 06:04:45,0.98,DeepFuckingValue,wallstreetbets,/r/wallstreetbets/comments/l846a1/gme_yolo_monthend_update_jan_2021/,False,False,False,False,False
It’s treason then,248690,l881ia,https://i.redd.it/d3t66lv1yce61.jpg,4587,1611963659.0,,2021-01-30 08:40:59,0.98,keenfeed,wallstreetbets,/r/wallstreetbets/comments/l881ia/its_treason_then/,False,False,False,False,False
"CLASS ACTION AGAINST ROBINHOOD. Allowing people to only sell is the definition of market manipulation. A class action must be started, Robinhood has made plenty of money off selling info about our trades to the hedge funds to be able to pay out a little for causing people to loose money now",228705,l6x130,https://www.reddit.com/r/wallstreetbets/comments/l6x130/class_action_against_robinhood_allowing_people_to/,17764,1611841751.0,"LEAVE ROBINHOOD. They dont deserve to make money off us after the millions they caused in losses. It might take a couple of days, but send Robinhood to the ground and GME to the moon.",2021-01-28 22:49:11,0.97,does-it-mater,wallstreetbets,/r/wallstreetbets/comments/l6x130/class_action_against_robinhood_allowing_people_to/,False,False,False,False,False
GME YOLO update — Feb 19 2021,225050,lnqgz8,https://i.redd.it/2xswz0h11ii61.png,12838,1613768755.0,,2021-02-20 06:05:55,0.96,DeepFuckingValue,wallstreetbets,/r/wallstreetbets/comments/lnqgz8/gme_yolo_update_feb_19_2021/,False,False,False,False,False
GME YOLO update — Jan 27 2021 --------------------------------------- guess i need 102 characters in title now,219116,l6ekdz,https://i.redd.it/a309gkm5yxd61.png,14586,1611782135.0,,2021-01-28 06:15:35,0.97,DeepFuckingValue,wallstreetbets,/r/wallstreetbets/comments/l6ekdz/gme_yolo_update_jan_27_2021_guess_i_need_102/,False,False,False,False,False
GME YOLO update — Feb 1 2021,217854,lae6j0,https://i.redd.it/og8ca1xskxe61.png,17997,1612213656.0,,2021-02-02 06:07:36,0.96,DeepFuckingValue,wallstreetbets,/r/wallstreetbets/comments/lae6j0/gme_yolo_update_feb_1_2021/,False,False,False,False,False
IT'S POWER TO THE TRADERS NOW,216835,l7feld,https://v.redd.it/lu8aekujd6e61,5621,1611884158.0,,2021-01-29 10:35:58,0.97,84935,wallstreetbets,/r/wallstreetbets/comments/l7feld/its_power_to_the_traders_now/,False,False,False,False,False
"Used some of my GME tendies to buy Nintendo Switches from Gamestop, then donated them to a Children's Hospital. Got featured on the local news and brought glory to WSB.",215437,l8c0u4,https://www.nbcdfw.com/news/local/north-texas-investor-uses-gamestop-gains-help-sick-children/2537134/,6977,1611975220.0,,2021-01-30 11:53:40,0.93,mpwrd,wallstreetbets,/r/wallstreetbets/comments/l8c0u4/used_some_of_my_gme_tendies_to_buy_nintendo/,False,False,False,False,False
That’s what I thought,202726,l890i7,https://i.redd.it/f2yhugwt5de61.jpg,4538,1611966275.0,,2021-01-30 09:24:35,0.97,keenfeed,wallstreetbets,/r/wallstreetbets/comments/l890i7/thats_what_i_thought/,False,False,False,False,False
Can we all take a moment and appreciate the Mods who have grinded through this and held our community together. Thank you.,197919,l6jobf,https://www.reddit.com/r/wallstreetbets/comments/l6jobf/can_we_all_take_a_moment_and_appreciate_the_mods/,6789,1611795452.0,,2021-01-28 09:57:32,0.95,[deleted],wallstreetbets,/r/wallstreetbets/comments/l6jobf/can_we_all_take_a_moment_and_appreciate_the_mods/,False,False,False,False,False
"It runs very deep, my friends.",194813,l79x17,https://i.redd.it/b8zy92sy85e61.jpg,2762,1611870475.0,,2021-01-29 06:47:55,0.98,game_stone,wallstreetbets,/r/wallstreetbets/comments/l79x17/it_runs_very_deep_my_friends/,False,False,False,False,False
I am proud to do my part in paying forward our good fortune with a donation of 6 Nintendo Switches and games to go with them to the Children’s Minnesota Hospital. Cant Stop. Won’t Stop. GameStop. (Still long 50 shares I WILL NOT SELL),190411,l90oq6,https://i.redd.it/sgrbt9vthke61.jpg,3793,1612055063.0,,2021-01-31 10:04:23,0.94,Lunar033,wallstreetbets,/r/wallstreetbets/comments/l90oq6/i_am_proud_to_do_my_part_in_paying_forward_our/,False,False,False,False,False
Crazy mannnnnnn. We can't let this slide at all,190407,l74tr1,https://i.redd.it/8bels7zob4e61.jpg,2366,1611859321.0,,2021-01-29 03:42:01,0.97,BootySenpai,wallstreetbets,/r/wallstreetbets/comments/l74tr1/crazy_mannnnnnn_we_cant_let_this_slide_at_all/,False,False,False,False,False
Drew this for you my fellow retards 💎🙌🏼,186949,l9kn3z,https://i.redd.it/h7sap8vb5qe61.jpg,3446,1612123498.0,,2021-02-01 05:04:58,0.91,spargeletto,wallstreetbets,/r/wallstreetbets/comments/l9kn3z/drew_this_for_you_my_fellow_retards/,False,False,False,False,False
Mark Cuban spent nearly 2 hours answering questions in his AMA. And then immediately called into CNBC to defend WSB!,182545,lazmky,https://i.redd.it/5gwwn8rxb3f61.jpg,4351,1612283143.0,,2021-02-03 01:25:43,0.95,nekenemkj,wallstreetbets,/r/wallstreetbets/comments/lazmky/mark_cuban_spent_nearly_2_hours_answering/,False,False,False,False,False
I’m so proud of you all.,181484,l79jko,https://i.redd.it/ykiux57d65e61.jpg,2401,1611869601.0,,2021-01-29 06:33:21,0.96,game_stone,wallstreetbets,/r/wallstreetbets/comments/l79jko/im_so_proud_of_you_all/,False,False,False,False,False
WE'RE IN THE ENDGAME NOW,177683,l7nces,https://v.redd.it/ilaw5wowd8e61,6404,1611908502.0,,2021-01-29 17:21:42,0.96,IDoLikeMyShishkebabs,wallstreetbets,/r/wallstreetbets/comments/l7nces/were_in_the_endgame_now/,True,False,False,False,False
GME YOLO update — Apr 16 2021 — final update,176333,msblc3,https://i.redd.it/n7m08253glt61.png,17807,1618604413.0,,2021-04-17 05:20:13,0.97,DeepFuckingValue,wallstreetbets,/r/wallstreetbets/comments/msblc3/gme_yolo_update_apr_16_2021_final_update/,False,False,False,False,False
WSB right now,173901,lb8jtk,https://i.redd.it/ptv7nhxy35f61.png,4124,1612305128.0,,2021-02-03 07:32:08,0.94,string_beans,wallstreetbets,/r/wallstreetbets/comments/lb8jtk/wsb_right_now/,False,False,False,False,False
In honor of finally seeing the almighty u/deepfuckingvalue. We must now do our part in having him written in the history books as the greatest that WallStreetBets has ever seen.,173704,l7z8pf,https://i.redd.it/2a8b56my8be61.jpg,3710,1611943114.0,,2021-01-30 02:58:34,0.97,always_plan_in_advan,wallstreetbets,/r/wallstreetbets/comments/l7z8pf/in_honor_of_finally_seeing_the_almighty/,False,False,False,False,False
GME YOLO update — Mar 8 2021,172266,m0q5bm,https://i.redd.it/9jfy2u8bdvl61.png,8048,1615237711.0,,2021-03-09 06:08:31,0.95,DeepFuckingValue,wallstreetbets,/r/wallstreetbets/comments/m0q5bm/gme_yolo_update_mar_8_2021/,False,False,False,False,False
Congress might do something for once,168800,l7c6kb,https://i.redd.it/3lo7rt55p5e61.jpg,6643,1611875915.0,,2021-01-29 08:18:35,0.96,[deleted],wallstreetbets,/r/wallstreetbets/comments/l7c6kb/congress_might_do_something_for_once/,False,False,False,False,False
A message to WSB from the Director of the Dian Fossey Gorilla Fund!,167252,m4i2ib,https://v.redd.it/l3stpkyrnvm61,5893,1615677272.0,,2021-03-14 08:14:32,0.94,kampingcarl,wallstreetbets,/r/wallstreetbets/comments/m4i2ib/a_message_to_wsb_from_the_director_of_the_dian/,True,False,False,False,False
GME YOLO update — Feb 2 2021,161992,lb6jld,https://i.redd.it/rr9n7obwq4f61.png,17330,1612300308.0,,2021-02-03 06:11:48,0.95,DeepFuckingValue,wallstreetbets,/r/wallstreetbets/comments/lb6jld/gme_yolo_update_feb_2_2021/,False,False,False,False,False
"Not sure if anyone posted this here, but yikes",161470,l7bh1m,https://i.redd.it/76bcnhs2k5e61.jpg,5703,1611874211.0,,2021-01-29 07:50:11,0.93,oofaloofa1,wallstreetbets,/r/wallstreetbets/comments/l7bh1m/not_sure_if_anyone_posted_this_here_but_yikes/,False,False,False,False,False
"Hey everyone, Its Mark Cuban. Jumping on to do an AMA.... so Ask Me Anything",159909,lawubt,https://www.reddit.com/r/wallstreetbets/comments/lawubt/hey_everyone_its_mark_cuban_jumping_on_to_do_an/,26209,1612276523.0,Lets Go !,2021-02-02 23:35:23,0.91,mcuban,wallstreetbets,/r/wallstreetbets/comments/lawubt/hey_everyone_its_mark_cuban_jumping_on_to_do_an/,False,False,False,False,False
IMPORTANT!! THERE ARE NO SELLERS!!! DO NOT PANIC IF YOU SEE PRICE DROP HOLD THE LINE! UPVOTE SO PEOPLE DON’T PANIC.,159205,l70b59,https://i.redd.it/j6g1paf4h3e61.jpg,4855,1611849005.0,,2021-01-29 00:50:05,0.97,[deleted],wallstreetbets,/r/wallstreetbets/comments/l70b59/important_there_are_no_sellers_do_not_panic_if/,False,False,False,False,False
Doing my part,158171,l78yde,https://i.redd.it/af2t6dp725e61.png,2768,1611868230.0,,2021-01-29 06:10:30,0.97,adnbenji,wallstreetbets,/r/wallstreetbets/comments/l78yde/doing_my_part/,False,False,False,False,False
Our favourite analyst. 🚀🚀🙌💎🌕,156554,l8tw56,https://i.redd.it/djm50uj2xie61.jpg,4083,1612035971.0,,2021-01-31 04:46:11,0.95,DawudM,wallstreetbets,/r/wallstreetbets/comments/l8tw56/our_favourite_analyst/,False,False,False,False,False
Forever never dies 🥰,155405,l92fas,https://i.redd.it/nn96rnp6yke61.jpg,2758,1612060560.0,,2021-01-31 11:36:00,0.92,Parliament--,wallstreetbets,/r/wallstreetbets/comments/l92fas/forever_never_dies/,False,False,False,False,False
In case you needed proof that there are imposters among us. A bot posting the same negative sentiment comment multiple times per minute 🌈🐻,152509,lafh4d,https://www.reddit.com/gallery/lafh4d,5882,1612216853.0,,2021-02-02 07:00:53,0.94,rumblesaurus69,wallstreetbets,/r/wallstreetbets/comments/lafh4d/in_case_you_needed_proof_that_there_are_imposters/,False,False,False,False,False
GME YOLO month-end update — Feb 2021,151025,lt7v4w,https://i.redd.it/20ro9puizvj61.png,7619,1614373638.0,,2021-02-27 06:07:18,0.95,DeepFuckingValue,wallstreetbets,/r/wallstreetbets/comments/lt7v4w/gme_yolo_monthend_update_feb_2021/,False,False,False,False,False
Mic drop,150661,l7aj2e,https://i.redd.it/ozzh6wv9d5e61.jpg,1798,1611871924.0,,2021-01-29 07:12:04,0.97,waaaaaaaaaaaaaaahhhh,wallstreetbets,/r/wallstreetbets/comments/l7aj2e/mic_drop/,False,False,False,False,False
Fake news 🤣,149308,la8n7o,https://i.redd.it/hqyf4qyxhwe61.jpg,6009,1612200400.0,,2021-02-02 02:26:40,0.92,giov1234,wallstreetbets,/r/wallstreetbets/comments/la8n7o/fake_news/,False,False,False,False,False
GME YOLO update — Feb 3 2021 – heads up gonna back off the daily updates for now,148253,lbykxg,https://i.redd.it/93vf02k2wbf61.png,9928,1612387105.0,,2021-02-04 06:18:25,0.95,DeepFuckingValue,wallstreetbets,/r/wallstreetbets/comments/lbykxg/gme_yolo_update_feb_3_2021_heads_up_gonna_back/,False,False,False,False,False
"WSB PIONEER. FEARLESS BAG HOLDER. BETTER THAN DIAMOND HANDS. RICHER THAN YOUR WIFE’S BOYFRIEND’S UNCLE. YES, THIS IS NONE OTHER THAN DEEPFUCKINGVALUE HIMSELF.",147571,l7weuu,https://i.redd.it/qdi8ldgrpae61.jpg,5741,1611936659.0,,2021-01-30 01:10:59,0.95,sugma22,wallstreetbets,/r/wallstreetbets/comments/l7weuu/wsb_pioneer_fearless_bag_holder_better_than/,False,False,False,False,False
"WSB, WHAT IS YOUR STRATEGY? 💎✋🚀",146951,l7qwvo,https://v.redd.it/gu8zbgeyf9e61,5124,1611921874.0,,2021-01-29 21:04:34,0.96,consygiere,wallstreetbets,/r/wallstreetbets/comments/l7qwvo/wsb_what_is_your_strategy/,True,False,False,False,False
If I can hold at -$10MM then you can hold too. 💎🙌,145456,l70vmz,https://i.redd.it/e2ra46rsk3e61.jpg,6946,1611850284.0,,2021-01-29 01:11:24,0.96,lantern_fan,wallstreetbets,/r/wallstreetbets/comments/l70vmz/if_i_can_hold_at_10mm_then_you_can_hold_too/,False,False,False,False,False
"Today, Interactive Brokers CEO admits that without the buying restrictions, $GME would have gone up in to the thousands",145336,lmagzp,https://v.redd.it/6v6qywrv35i61,7818,1613612240.0,,2021-02-18 10:37:20,0.93,indonesian_activist,wallstreetbets,/r/wallstreetbets/comments/lmagzp/today_interactive_brokers_ceo_admits_that_without/,False,False,False,False,False
We are all the way up,144999,l7dg1g,https://v.redd.it/jj0wn3cfy5e61,1964,1611879053.0,,2021-01-29 09:10:53,0.97,keenfeed,wallstreetbets,/r/wallstreetbets/comments/l7dg1g/we_are_all_the_way_up/,False,False,False,False,False
"An Open Letter to Melvin Capital, CNBC, Boomers, and WSB",144093,l6omry,https://www.reddit.com/r/wallstreetbets/comments/l6omry/an_open_letter_to_melvin_capital_cnbc_boomers_and/,7574,1611810374.0," **Mods do not delete, this is important to me, please read**

&#x200B;

I was in my early teens during the '08 crisis. I vividly remember the enormous repercussions that the reckless actions by those on Wall Street had in my personal life, and the lives of those close to me. I was fortunate - my parents were prudent and a little paranoid, and they had some food storage saved up. When that crisis hit our family, we were able to keep our little house, but we lived off of pancake mix, and powdered milk, and beans and rice for a year. Ever since then, my parents have kept a food storage, and they keep it updated and fresh.

Those close to me, my friends and extended family, were not nearly as fortunate. My aunt moved in with us and paid what little rent she could to my family while she tried to find any sort of work. Do you know what tomato soup made out of school cafeteria ketchup packets taste like? My friends got to find out. Almost a year after the crisis' low, my dad had stabilized our income stream and to help out others, he was hiring my friends' dads for odd house work. One of them built a new closet in our guest room. Another one did some landscaping in our backyard. I will forever be so proud of my parents, because in a time of need, even when I have no doubt money was still tight, they had the mindfulness and compassion to help out those who absolutely needed it.

To Melvin Capital: you stand for everything that I hated during that time. You're a firm who makes money off of exploiting a company and manipulating markets and media to your advantage. Your continued existence is a sharp reminder that the ones in charge of so much hardship during the '08 crisis were not punished. And your blatant disregard for the law, made obvious months ago through your (for the Melvin lawyers out there: alleged) illegal naked short selling and more recently your obscene market manipulation after hours shows that you haven't learned a single thing since '08. And why would you? Your ilk were bailed out and rewarded for terrible and illegal financial decisions that negatively changed the lives of millions. I bought shares a few days ago. I dumped my savings into GME, paid my rent for this month with my credit card, and dumped my rent money into more GME (which for the people here at WSB, I would not recommend). And I'm holding. This is personal for me, and millions of others. You can drop the price of GME after hours $120, I'm not going anywhere. You can pay for thousands of reddit bots, I'm holding. You can get every mainstream media outlet to demonize us, I don't care. I'm making this as painful as I can for you.

To CNBC: you must realize your short term gains through promoting institutions' agenda is just that - short term. Your staple audience will soon become too old to care, and the millions of us, not just at WSB but every person affected by the '08 crash that's now paying attention to GME, are going to remember how you stuck up for the firms that ruined so many of us, and tried to tear down the little guys. I know for sure I'll remember this. In response, here is a [list of CNBC sponsors and partners](https://www.cnbcevents.com/sponsors/). They include, but are not limited to, **IBM**, **Cisco**, **TMobile**, **JPMorgan**, **Oracle**, and **ZipRecruiter**. Their parent company is [NBCUniversal](https://en.wikipedia.org/wiki/NBCUniversal), owned by **Comcast** and **GE**.

To the boomers, and/or people close to that age, just now paying attention to these ""millennial blog posts"": you realize that, even if you weren't adversely effected by the '08 crash, your children and perhaps grandchildren most likely were? *We're not enemies, we're on the same side*. Stop listening to the media that's making us out to be market destroyers, and start rooting for us, because we have a once in a lifetime opportunity to punish the sort of people who caused so much pain and stress a decade ago, and we're taking that opportunity. Your children, your grandchildren, might have suffered as I described because of the institutions that we're fighting against. You really want to choose them, over your own family and friends? We're not asking you to risk your 401k or retirement fund on a single GME bet. We're just asking you to be understanding, supportive, and to not support the people that caused so much suffering a decade ago.

To WSB: you all are amazing. I imagine that I'm not the only one that this is personal for. I've read myself so many posts on what you guys went through during the '08 crash. Whether you're here for the gains, to stick it to the man as I am, or just to be part of a potentially market changing movement - thank you. Each and every one of you are the reason that we have this chance. I've never felt this optimistic about the future before. This is life changing amounts of money for so many of you, and to be part of a rare instance of a wealth distribution from the rich to the poor is just incredible. I love you all.

&#x200B;

&#x200B;

Note: I can't seem to get a hold of mods and they keep fucking removing the post. I have no idea how to get this to stick and its important to me that the people I'm addressing read it.",2021-01-28 14:06:14,0.93,[deleted],wallstreetbets,/r/wallstreetbets/comments/l6omry/an_open_letter_to_melvin_capital_cnbc_boomers_and/,False,False,False,False,False
GameStop gear going to the new home at the Children’s hospital of Atlanta Monday. POWER TO THE PLAYERS !,142615,mf0msr,https://i.redd.it/4v4vipu0krp61.jpg,2369,1616934880.0,,2021-03-28 21:34:40,0.9,CockInAClock,wallstreetbets,/r/wallstreetbets/comments/mf0msr/gamestop_gear_going_to_the_new_home_at_the/,False,False,False,False,False
PREACH,142447,l6b69k,https://i.redd.it/5tcc1yym4xd61.jpg,2384,1611772166.0,,2021-01-28 03:29:26,0.96,basava18,wallstreetbets,/r/wallstreetbets/comments/l6b69k/preach/,False,False,False,False,False
"I don't need Fox Business to hold me accountable, but I'll take it!",140729,lsgqig,https://i.redd.it/onrq8o9ptoj61.jpg,2440,1614286746.0,,2021-02-26 05:59:06,0.95,travislifestyle,wallstreetbets,/r/wallstreetbets/comments/lsgqig/i_dont_need_fox_business_to_hold_me_accountable/,True,False,False,False,False
GME YOLO update — Jan 26 2021,140365,l5nphz,https://i.redd.it/cltvfhzmrqd61.png,9277,1611695283.0,,2021-01-27 06:08:03,0.94,DeepFuckingValue,wallstreetbets,/r/wallstreetbets/comments/l5nphz/gme_yolo_update_jan_26_2021/,False,False,False,False,False
Like this post if you are holding!!💎 The real squeeze is yet to happen🚀,139439,l71fl1,https://www.reddit.com/r/wallstreetbets/comments/l71fl1/like_this_post_if_you_are_holding_the_real/,6772,1611851430.0,"Buy more during dips if you can, but at least hold.

We just have to hold until they fold. Today's actions by several brokers just show how desperate the hedge funds are getting.

Hold with your immovable diamond hands for all that you hold dear and we will be breaking Wall Street **TOGETHER** while making gargantuan tendies in the end!

**WE LIKE THE STOCK.**

Comment with brokers that aren't corruptible and that we can move to fast!

**YOU CAN STILL BUY ON**  
**Fidelity** (10k instant deposit, accounts can be opened quickly)  
**Others:** Vanguard, Revolut, TastyWorks, Charles Schwab, TD Ameritrade, Webull, Degiro, Wells Fargo, M1, Public, etc.

*Edit*: It seems like TD Ameritrade, Webull, M1 Finance, and Public have removed their restrictions. Brokers are folding to the political support we are receiving.

[**http://isthesqueezesquoze.com/**](http://isthesqueezesquoze.com/)",2021-01-29 01:30:30,0.97,uwillmire,wallstreetbets,/r/wallstreetbets/comments/l71fl1/like_this_post_if_you_are_holding_the_real/,False,False,False,False,False
First of many lawsuits I hope 🤞🏻 out of this bullshit!!!! #DownWithTheHOOD,134709,l73giz,https://i.redd.it/082ihpop04e61.jpg,5067,1611855593.0,,2021-01-29 02:39:53,0.96,iiArmy,wallstreetbets,/r/wallstreetbets/comments/l73giz/first_of_many_lawsuits_i_hope_out_of_this/,False,False,False,False,False
Billboard! Went full retard!🚀🚀 North of Dallas along super busy I-35,133587,lbb12w,https://i.redd.it/mykky4blq5f61.jpg,2307,1612312251.0,,2021-02-03 09:30:51,0.9,FlawlessBoltX,wallstreetbets,/r/wallstreetbets/comments/lbb12w/billboard_went_full_retard_north_of_dallas_along/,False,False,False,False,False
"Billboard in Oklahoma City, OK! If someone can rent out a billboard for GME you can hold your shares!!! 💎 🖐!!!! (Left watermark for credit)",132868,l8hsjd,https://i.redd.it/05ow7o3dqfe61.jpg,3214,1611997395.0,,2021-01-30 18:03:15,0.95,coookiesfoo,wallstreetbets,/r/wallstreetbets/comments/l8hsjd/billboard_in_oklahoma_city_ok_if_someone_can_rent/,False,False,False,False,False
Charles Payne gets it!,131140,l70rzy,https://i.redd.it/1uii0mb9k3e61.jpg,992,1611850059.0,,2021-01-29 01:07:39,0.98,cyberupdate,wallstreetbets,/r/wallstreetbets/comments/l70rzy/charles_payne_gets_it/,False,False,False,False,False
GME YOLO update — Mar 23 2021,130625,mbpclz,https://i.redd.it/1jmlo9wwiuo61.png,8043,1616535031.0,,2021-03-24 06:30:31,0.93,DeepFuckingValue,wallstreetbets,/r/wallstreetbets/comments/mbpclz/gme_yolo_update_mar_23_2021/,False,False,False,False,False
"u/DeepFuckingValue is being asked to testify in the upcoming GameStop hearing. ""Diamond hands and tendies gonna enter the Congressional Record""",130030,lc1udz,https://i.redd.it/qtmt9ovgmcf61.png,5609,1612395828.0,,2021-02-04 08:43:48,0.94,jamsi,wallstreetbets,/r/wallstreetbets/comments/lc1udz/udeepfuckingvalue_is_being_asked_to_testify_in/,False,False,False,False,False
Honor to Diamond Hands.,129697,l81fgb,https://i.redd.it/xaaphlp7nbe61.png,2506,1611948006.0,,2021-01-30 04:20:06,0.96,freshwater21,wallstreetbets,/r/wallstreetbets/comments/l81fgb/honor_to_diamond_hands/,False,False,False,False,False
"Cool, but why would they bother telling us?",129080,l8xsfa,https://i.redd.it/d59d324psje61.jpg,8582,1612046608.0,,2021-01-31 07:43:28,0.93,Fargraven,wallstreetbets,/r/wallstreetbets/comments/l8xsfa/cool_but_why_would_they_bother_telling_us/,False,False,False,False,False
"Listen, it’s easy",128457,ldnmj9,https://i.redd.it/87u6ut6horf61.jpg,3245,1612577891.0,,2021-02-06 11:18:11,0.89,PancakesandScotch,wallstreetbets,/r/wallstreetbets/comments/ldnmj9/listen_its_easy/,False,False,False,False,False
CNN BACK. OFF. This is a LIE. Literally a 5 second scroll of our board would inform this to be untrue. EDUCATE yourselves!!!!!,127706,la6e16,https://i.redd.it/fj495vh52we61.jpg,5924,1612195071.0,,2021-02-02 00:57:51,0.91,spylord5,wallstreetbets,/r/wallstreetbets/comments/la6e16/cnn_back_off_this_is_a_lie_literally_a_5_second/,False,False,False,False,False
Welcome to the Endgame.,126886,l8mzow,https://v.redd.it/l1pa6yuvdhe61,5392,1612017491.0,,2021-01-30 23:38:11,0.94,jeepers_sheepers,wallstreetbets,/r/wallstreetbets/comments/l8mzow/welcome_to_the_endgame/,False,False,False,False,False
Do you think he realized it YES OR NO,126639,lngem6,https://i.redd.it/c8rg4qcntfi61.jpg,3343,1613742948.0,,2021-02-19 22:55:48,0.93,jacored,wallstreetbets,/r/wallstreetbets/comments/lngem6/do_you_think_he_realized_it_yes_or_no/,True,False,False,False,False
You know something is about to go down when most members of Congress are United over Wall Street trying to fuck us.,124065,l77lgx,https://i.redd.it/j62vcq6gt4e61.jpg,2693,1611865257.0,,2021-01-29 05:20:57,0.98,game_stone,wallstreetbets,/r/wallstreetbets/comments/l77lgx/you_know_something_is_about_to_go_down_when_most/,False,False,False,False,False
"$265,000 raised so far for Dian Fossey Gorilla Fund ❤️#GMEToTheMoon #ApesStrongTogether 🍌🦍🚀🌕",123577,m5pm5c,https://i.redd.it/e2tnaniy58n61.jpg,2755,1615828417.0,,2021-03-16 02:13:37,0.89,LilHMoney,wallstreetbets,/r/wallstreetbets/comments/m5pm5c/265000_raised_so_far_for_dian_fossey_gorilla_fund/,False,False,False,False,False
"DFV’s smile, he’s watching all us apes support him.",122706,lmyan9,https://i.redd.it/detip0vi4bi61.jpg,2773,1613685014.0,,2021-02-19 06:50:14,0.91,BAKAYAROUUUUU,wallstreetbets,/r/wallstreetbets/comments/lmyan9/dfvs_smile_hes_watching_all_us_apes_support_him/,False,False,False,False,False
Oops,121784,l6z1yp,https://i.redd.it/0gnr4u6193e61.png,1040,1611846400.0,,2021-01-29 00:06:40,0.97,yellow_duck12,wallstreetbets,/r/wallstreetbets/comments/l6z1yp/oops/,False,False,False,False,False
