title,score,id,url,comms_num,created,body,timestamp,upvote_ratio,author,subreddit,permalink,is_original_content,over_18,spoiler,locked,stickied
It seems like you already know where,82484,luzpgy,https://v.redd.it/1fkc75aceck61,1038,1614572123.0,,2021-03-01 13:15:23,0.92,[deleted],wallstreetbets,/r/wallstreetbets/comments/luzpgy/it_seems_like_you_already_know_where/,False,False,False,False,False
Goodbye.,82143,lhdctb,https://v.redd.it/a6woupge5sg61,1823,1613019564.0,,2021-02-11 13:59:24,0.88,Skillshot,wallstreetbets,/r/wallstreetbets/comments/lhdctb/goodbye/,True,False,False,False,False
"Ladies and Gentlemen, WE GOT THEM",82136,l7f95j,https://v.redd.it/bva2q98dc6e61,1563,1611883766.0,,2021-01-29 10:29:26,0.94,[deleted],wallstreetbets,/r/wallstreetbets/comments/l7f95j/ladies_and_gentlemen_we_got_them/,False,False,False,False,False
Big boys are rooting for us. This is far from over so FUCKING HOLD,81775,l6yey9,https://i.redd.it/1wuwn6bj53e61.jpg,1703,1611845109.0,,2021-01-28 23:45:09,0.98,Naldo5711,wallstreetbets,/r/wallstreetbets/comments/l6yey9/big_boys_are_rooting_for_us_this_is_far_from_over/,False,False,False,False,False
Vlad on his way to commit market manipulation after seeing the GME price,81724,lsaiv5,https://v.redd.it/szcho43lhnj61,1465,1614270693.0,,2021-02-26 01:31:33,0.93,[deleted],wallstreetbets,/r/wallstreetbets/comments/lsaiv5/vlad_on_his_way_to_commit_market_manipulation/,False,False,False,False,False
AM I CLEAR NOW? WE HOLD 💎🙌🚀,81481,l9sy3f,https://i.redd.it/v2om2r0s5se61.jpg,4216,1612147861.0,,2021-02-01 11:51:01,0.87,dhiral1994,wallstreetbets,/r/wallstreetbets/comments/l9sy3f/am_i_clear_now_we_hold/,False,False,False,False,False
DIAMONDHANDS LETS GO,81250,lf128l,https://i.redd.it/xttxx6f4s5g61.jpg,1204,1612748624.0,,2021-02-08 10:43:44,0.82,bawse1,wallstreetbets,/r/wallstreetbets/comments/lf128l/diamondhands_lets_go/,False,False,False,False,False
Jon Stewart just joined twitter and he likes the stock!,81204,l7a9m0,https://i.redd.it/jelkylebb5e61.png,717,1611871298.0,,2021-01-29 07:01:38,0.98,madmax_br5,wallstreetbets,/r/wallstreetbets/comments/l7a9m0/jon_stewart_just_joined_twitter_and_he_likes_the/,False,False,False,False,False
We are currently on this step of the process. HOLD💎🤗,81187,lax6r8,https://i.redd.it/6vfagjovu2f61.gif,2520,1612277378.0,,2021-02-02 23:49:38,0.96,Hoboeser,wallstreetbets,/r/wallstreetbets/comments/lax6r8/we_are_currently_on_this_step_of_the_process_hold/,False,False,False,False,False
💎 🦍🚀,80765,ma6olt,https://i.redd.it/aztlvcad9go61.jpg,886,1616362266.0,,2021-03-22 06:31:06,0.91,GetShorty313,wallstreetbets,/r/wallstreetbets/comments/ma6olt/_/,False,False,False,False,False
Fixed it from a previous post:,80507,qr1jo7,https://i.redd.it/eisgke77gty71.jpg,1383,1636570964.0,,2021-11-11 04:02:44,0.94,JosefSchnitzel,wallstreetbets,/r/wallstreetbets/comments/qr1jo7/fixed_it_from_a_previous_post/,False,False,False,False,False
I feel like clarification is needed about Today,80089,laikd0,https://www.reddit.com/r/wallstreetbets/comments/laikd0/i_feel_like_clarification_is_needed_about_today/,4917,1612225067.0,"There’s a lot of new people on here that don’t really understand the play going on right now on both sides and I felt like we need to clear up some misconceptions so you can make your own decisions. 

**Why no spike today?**:

First of all, we can’t know on what day the Squeeze happens / they cover their shorts. 
All we know is it has to happen sooner or later since the hedgefunds are losing millions if not billions EVERY SINGLE DAY THEY DON’T COVER. 
They use several tactics to delay it, but they can’t circumvent it.
They’re bleeding, and all the retail investors holding are slowly sucking the blood out of their fat ugly bodies.

It might take just a few days, or weeks...
But eventually, when they cover, WE retail investors get to set the price.
That’s why you keep seeing 10k (or 69420$) is not a meme. Because it’s not.

We also know they’re down BAD. Why?
Because they’re attacking us any way they can and wasting millions doing so.

So let’s see what tactics they are using:

**Short ladder attacks**:

What is a short ladder attack? 
The big hedgefunds are putting in lower and lower bid prices between themselves. There is little to no volume on those trades, and since no one can buy, it ""looks"" like the stock is plummeting. It’s only effective if we would sell. 

https://www.reddit.com/r/wallstreetbets/comments/l9ay2s/short_ladder_attack_explained/?utm_source=share&utm_medium=ios_app&utm_name=iossmf
https://www.reddit.com/r/wallstreetbets/comments/la6vcb/wall_street_plan_trying_to_psychologically_scare/?utm_source=share&utm_medium=ios_app&utm_name=iossmf

Just look at the volume. People are not selling:
https://www.reddit.com/r/wallstreetbets/comments/la5upr/dont_panic_and_just_look_at_the_fucking_volume/?utm_source=share&utm_medium=ios_app&utm_name=iossmf

**Infiltrating WSB and other social media**:

Here are some random screenshots I took of WSB Synth. Notice the people saying to jump ship and to take GME gains and invest into FORD. Obvious shills. There’s tons of them. Always new, or old accounts that suddenly post again. All those people came in just in time when the short ladder attacks started, just to make it look like people are panic selling and convince us to sell:
https://www.reddit.com/r/wallstreetbets/comments/lahqex/notice_the_two_obvious_melvin_employees_time_to/?utm_source=share&utm_medium=ios_app&utm_name=iossmf

**Manipulating the Media**: 

Here are some News channels caught lying / manipulating the market: (SEC if you read this...)
https://www.reddit.com/r/wallstreetbets/comments/la8n7o/fake_news/
https://www.reddit.com/r/wallstreetbets/comments/la6e16/cnn_back_off_this_is_a_lie_literally_a_5_second/
https://www.reddit.com/r/wallstreetbets/comments/l9runf/the_silver_squeeze_is_a_hedgefund_coordinated/?utm_source=share&utm_medium=ios_app&utm_name=iossmf
https://www.reddit.com/r/wallstreetbets/comments/la8x7g/bloomberg_now_insisting_gme_is_old_news_ha/?utm_source=share&utm_medium=ios_app&utm_name=iossmf


Now let’s get some clarification on **SILVER:**

There is so much misinformation swirling around concerning Silver. People don’t seem to realize 3 things:

1. **Silver is not a get rich quick move. Silver is a LONG TERM HOLD move.** GME is a risky short term play. So YOU decide what makes more sense to get in right now. (Personally I sold all my stocks to buy GME today. YOLO) 
2. The actual Silver sub on reddit does not advocate buying SLV, nor do most of them believe SLV is the move to make. 
3. The hedge funds would love for you to go all-in on Silver and ignore the GME opportunity. Every dollar spent on SLV instead of GME is a double win for them, since SLV is inverting GME and they own a ton of Silver and that’s why they’re pushing this narrative in the media. 

SLV inverting GME: 
https://www.reddit.com/r/wallstreetbets/comments/la4mog/stop_buying_slv_you_smooth_brained_retards_its/?utm_source=share&utm_medium=ios_app&utm_name=iossmf

The amount of paper contracts or IShares SLV available is basically infinite. Physical silver is a rare physical commodity with a finite supply, and a very low supply of retail sized bars/rounds/coins.

**IF** you want to go into silver for whatever reason, buy physical. But that’s just my retard opinion. 

**SILVER ISN’T “REDDITS NEXT BIG PLAY“.** You guys need to realize the GME situation is very unique and WSB is not, and never was about starting crazy short squeezes. GME is a rare opportunity where the big guys actually fucked up BIG TIME.

Silver squeeze not happening links: 
https://www.reddit.com/r/wallstreetbets/comments/la1o04/there_is_no_silver_short_squeeze_happening_none/?utm_source=share&utm_medium=ios_app&utm_name=iossmf
https://www.reddit.com/r/wallstreetbets/comments/la1xhf/guess_who_owns_tonnes_of_slv_options_fuck_citadel/?utm_source=share&utm_medium=ios_app&utm_name=iossmf
https://www.reddit.com/r/wallstreetbets/comments/l9runf/the_silver_squeeze_is_a_hedgefund_coordinated/?utm_source=share&utm_medium=ios_app&utm_name=iossmf

Well. Let’s see to what extend they fucked up exactly: 

**Short Version:**
The short version is that a review of the **'strategic fails–to–deliver'** data indicates that institutional insiders may have counterfeited a massive number of Gamestop shares which is why they tried to stop retail investors from buying more shares on Thursday.

There are are **71 million shares** of GME that have ever been issued by the company. Institutions have reported to the SEC via 13F filings that they own more than **102,000,000** shares (including the 13% of GME stock is owned by Ryan Cohen).  That is already 30,000,000 shares more than even exist.

On top of the shares reportedly owned by institutions, retail investors may currently hold 50+ million shares (counting both  long holdings and call options – both ITM and OTM).  

Once you include call options, **retail investors may already hold more than 100% of GME (not just 100% of the float, more than 100% of the actual company)**. This would be definitive proof of illegal activity at the highest levels of the financial system.

Long version here: https://www.reddit.com/r/wallstreetbets/comments/l9rk78/sec_doj_60_minutes_public_data_suggests_massive/?utm_source=share&utm_medium=ios_app&utm_name=iossmf

**At these levels it’s NOT about the price, it’s about the number of shares in the hedgefunds possession. That’s why they want you to sell so bad.**

🤚🏼💎🤚🏼💎🤚🏼💎🤚🏼💎🤚🏼💎🤚🏼💎🤚🏼💎🤚🏼💎

Last but not least I’m holding because this is a once in a lifetime opportunity. I’m holding because I hope to see a better future and I’m holding for all you out there. 
To the Moon or zero. 

🦍🦍🦍 APES. STRONG. TOGETHER. 🦍🦍🦍

Disclaimer: 
This is not financial advice, I’m literally an ape. I just like the stock. Do your own DD and avoid the fake new and/or resurrected accounts here and the manipulative Media.

Edit: wanted to post a few new posts but it seems like I’m shadow banned. No one can see my posts. 
I don’t know if I got caught in some kind of spam filter.
u/only1parkjisung can a mod confirm this?",2021-02-02 09:17:47,0.93,ColdaxOfficial,wallstreetbets,/r/wallstreetbets/comments/laikd0/i_feel_like_clarification_is_needed_about_today/,False,False,False,False,False
I find myself in a position to pay for a service that I hope I never need to use - $5000 Donation to Children's Hospital,79968,l8rd1n,https://i.redd.it/lwh27absdie61.jpg,1333,1612029501.0,,2021-01-31 02:58:21,0.97,psytokine_storm,wallstreetbets,/r/wallstreetbets/comments/l8rd1n/i_find_myself_in_a_position_to_pay_for_a_service/,False,False,False,False,False
DFV(u/DeepFuckingValue) Just Got A Shoutout From Our Favorite Analyst,79674,l6a5z5,https://i.redd.it/1a2iywo7xwd61.png,839,1611769673.0,,2021-01-28 02:47:53,0.98,OOminati1,wallstreetbets,/r/wallstreetbets/comments/l6a5z5/dfvudeepfuckingvalue_just_got_a_shoutout_from_our/,False,False,False,False,False
Consulting with my advisor for Monday's picks.,79576,lz2kg8,https://i.redd.it/bhfqa0xn3fl61.gif,836,1615040697.0,,2021-03-06 23:24:57,0.93,uomee1,wallstreetbets,/r/wallstreetbets/comments/lz2kg8/consulting_with_my_advisor_for_mondays_picks/,False,False,False,False,False
i did something retarded,79548,mphitx,https://v.redd.it/dsyxkm0lrrs61,2818,1618245016.0,,2021-04-13 01:30:16,0.72,Sagar_Gaut,wallstreetbets,/r/wallstreetbets/comments/mphitx/i_did_something_retarded/,False,False,False,False,False
Tbh I only trust retards.,79307,msv8n1,https://i.redd.it/s1bw6qiwsrt61.gif,1188,1618681270.0,,2021-04-18 02:41:10,0.84,GenKaYY,wallstreetbets,/r/wallstreetbets/comments/msv8n1/tbh_i_only_trust_retards/,False,False,False,False,False
I KNEW MY SIMULATIONS WERE CORRECT!!!,79036,lryxbl,https://v.redd.it/t1r360zl4kj61,963,1614230086.0,,2021-02-25 14:14:46,0.92,Bolzat,wallstreetbets,/r/wallstreetbets/comments/lryxbl/i_knew_my_simulations_were_correct/,False,False,False,False,False
u/DeepFuckingValue has a Wikipedia page now,78967,lo32zv,https://i.redd.it/gtpaof5sili61.png,1424,1613810948.0,,2021-02-20 17:49:08,0.9,Sixstringcal,wallstreetbets,/r/wallstreetbets/comments/lo32zv/udeepfuckingvalue_has_a_wikipedia_page_now/,False,False,False,False,False
"Me, flying first class for the first time:",78757,m0vc73,https://i.redd.it/y26yr0bemwl61.gif,878,1615252834.0,,2021-03-09 10:20:34,0.93,TheFlyingElbow,wallstreetbets,/r/wallstreetbets/comments/m0vc73/me_flying_first_class_for_the_first_time/,True,False,False,False,False
Cheers everyone!,78668,msfw2x,https://v.redd.it/5xaihidtjmt61,2241,1618617925.0,,2021-04-17 09:05:25,0.9,TheRoaringKitty,wallstreetbets,/r/wallstreetbets/comments/msfw2x/cheers_everyone/,False,False,False,False,False
"CNBC & other media, here's a lesson on WSB lingo for you",78516,ltc6ps,https://v.redd.it/5vm0lrj82xj61,1423,1614386575.0,,2021-02-27 09:42:55,0.89,The_Sun_Will_Explode,wallstreetbets,/r/wallstreetbets/comments/ltc6ps/cnbc_other_media_heres_a_lesson_on_wsb_lingo_for/,True,False,False,False,False
Melvin & Friends,78283,l94qrn,https://i.redd.it/h9o4bl8rkle61.gif,1355,1612068163.0,,2021-01-31 13:42:43,0.94,Myllokunmingia,wallstreetbets,/r/wallstreetbets/comments/l94qrn/melvin_friends/,True,False,False,False,False
Actual Footage of Jeff Bezos Flight to Space…,78084,oo1w2t,https://v.redd.it/jz2v6op0cdc71,1090,1626787194.0,,2021-07-20 22:19:54,0.89,MikeyChill,wallstreetbets,/r/wallstreetbets/comments/oo1w2t/actual_footage_of_jeff_bezos_flight_to_space/,False,False,False,False,False
Wallstreetbets I fucking love you,77907,lio3yz,https://i.redd.it/qzrpakn0w4h61.jpg,3147,1613173665.0,,2021-02-13 08:47:45,0.71,[deleted],wallstreetbets,/r/wallstreetbets/comments/lio3yz/wallstreetbets_i_fucking_love_you/,False,False,False,False,False
AOC Turning into Dave Portnoy 🚀,77704,l75mep,https://i.redd.it/7i4e7x4vg4e61.jpg,2562,1611861024.0,,2021-01-29 04:10:24,0.88,tatbat1,wallstreetbets,/r/wallstreetbets/comments/l75mep/aoc_turning_into_dave_portnoy/,False,False,False,False,False
These tactics are as see through as my hands,77614,la7e12,https://v.redd.it/qlnhbmw29we61,959,1612197439.0,,2021-02-02 01:37:19,0.96,WhiteningMcClean,wallstreetbets,/r/wallstreetbets/comments/la7e12/these_tactics_are_as_see_through_as_my_hands/,False,False,False,False,False
Guess who owns tonnes of $SLV options? Fuck Citadel. This shit is co-ordinated,77558,la1xhf,https://whalewisdom.com/stock/slv,2145,1612182317.0,,2021-02-01 21:25:17,0.9,confusedhouseplants,wallstreetbets,/r/wallstreetbets/comments/la1xhf/guess_who_owns_tonnes_of_slv_options_fuck_citadel/,False,False,False,False,False
"Tomorrow, live from the capitol, 2/18/21 12PM ET",77397,llt8oo,https://v.redd.it/oganlg9b51i61,1816,1613564248.0,,2021-02-17 21:17:28,0.89,indonesian_activist,wallstreetbets,/r/wallstreetbets/comments/llt8oo/tomorrow_live_from_the_capitol_21821_12pm_et/,False,False,False,False,False
We like the stock,77396,mqt06d,https://v.redd.it/qn59ohbvq5t61,1334,1618414230.0,,2021-04-15 00:30:30,0.87,keenfeed,wallstreetbets,/r/wallstreetbets/comments/mqt06d/we_like_the_stock/,False,False,False,False,False
Why the fuck are we acting like we lost? We made GME go from 4 to 400 and it took combined trading platforms to silence and cheat to bring it to 90.,77294,lb8lwf,https://www.reddit.com/r/wallstreetbets/comments/lb8lwf/why_the_fuck_are_we_acting_like_we_lost_we_made/,5344,1612305252.0,"Did everyone forget what happened in Thursday? That was a calculated effort to bring down our position. FUCK OFF BILLIONAIRS, well still take you fucking money; who do you think will fund our food stamps?

We didn’t “lose” because we made a bad call, we “lost” because we made the RIGHT call and this disturbed  some folks at the top. 

I was reading 2 articles in Wall Street journal and it made my blood boil- first article was saying “random penny stock went up 30% with no news or announcement”- the people that are paid to predict and report and are the expert at stock market are saying this shit. The second article right after made me want to fuck the writers wife: “GME and AMC, Reddit favorite stocks, plunged after apparent loss in interest from retail investors” LOSS IN  INTEREST? MOTHERFUCKER WE CAN ONLY BUY 5 FUCKING SHARES EACH. 

WE LIKE THE STOCK. THOSE FUCKS JUST DON’T LET US BUY IT. How is GameStop and AMC and BB not already suing robinhood? Is any stock expert really gonna act like had they not restricted in Thursday, it would have went down that much? 

What the fuck is this gaslighting? That last week didn’t happen? Why are every news channel acting like they called GME or BB or AMC falling like it happened organically and not deliberately by everyone involved? 

Is GME worth 400$? FUCK NO. But since when was the stock market about actual worth? Stocks have become fiat currency in themself, doesn’t matter than company quarterly earnings, or its news, if people buy it, it goes up. When you restrict that- it goes down. 

We were up against billions of fund, trading platforms that we do not own or have a say in, our weapons, controlled by the enemy. Those fucks in TV acting like they actually called GME falling like this or acting like this is perfectly normal are trying to gaslight us about what happened in Thursday. 

FUCK THEM. We still got GME to go up and caused international fevor- we made the right call, we had the right stock, we had the right people, our enemies just had control of the only weapon we could use.",2021-02-03 07:34:12,0.82,JoeWelburg,wallstreetbets,/r/wallstreetbets/comments/lb8lwf/why_the_fuck_are_we_acting_like_we_lost_we_made/,False,False,False,False,False
Bought a car with $GME tendies-had to say thanks,77242,lq4udf,https://i.redd.it/psk8mb3mj4j61.jpg,2563,1614041201.0,,2021-02-23 09:46:41,0.81,JcAu20,wallstreetbets,/r/wallstreetbets/comments/lq4udf/bought_a_car_with_gme_tendieshad_to_say_thanks/,False,False,False,False,False
My portfolio this week,77102,m2cbs1,https://v.redd.it/8z2f7anjdam61,735,1615419390.0,,2021-03-11 08:36:30,0.94,jameizing777,wallstreetbets,/r/wallstreetbets/comments/m2cbs1/my_portfolio_this_week/,False,False,False,False,False
It’s a sign,77055,m1v741,https://v.redd.it/9vvmhpxlo6m61,1181,1615374634.0,,2021-03-10 20:10:34,0.89,Carvalho355,wallstreetbets,/r/wallstreetbets/comments/m1v741/its_a_sign/,False,False,False,False,False
HEY SEC - Here's your market manipulation. RH working to keep GME down.,76883,l81luf,https://i.redd.it/kbp7f07eobe61.png,2360,1611948417.0,,2021-01-30 04:26:57,0.98,Tsukune_Surprise,wallstreetbets,/r/wallstreetbets/comments/l81luf/hey_sec_heres_your_market_manipulation_rh_working/,False,False,False,False,False
Food bank donation with GME gains. Shelves fully stocked with tendies.,76754,lob61p,https://i.imgur.com/VeP09Ax.jpg,1638,1613839993.0,,2021-02-21 01:53:13,0.9,TheElgringo,wallstreetbets,/r/wallstreetbets/comments/lob61p/food_bank_donation_with_gme_gains_shelves_fully/,False,False,False,False,False
They Underestimated How Retarded We Are...,76496,l7jgk3,https://v.redd.it/rz0yz3moa7e61,1278,1611895367.0,,2021-01-29 13:42:47,0.96,HoldUntilYouDie,wallstreetbets,/r/wallstreetbets/comments/l7jgk3/they_underestimated_how_retarded_we_are/,True,False,False,False,False
Hold!,75948,l8ky1i,https://v.redd.it/vf4zwzhjtge61,1970,1612010640.0,,2021-01-30 21:44:00,0.96,gloini,wallstreetbets,/r/wallstreetbets/comments/l8ky1i/hold/,True,False,False,False,False
MARC CUBAN SUPPORTS WSB! 🚀🚀🚀,75379,l6w42a,https://i.redd.it/qg7j9hfyn2e61.png,613,1611839209.0,,2021-01-28 22:06:49,0.98,kangis_khan,wallstreetbets,/r/wallstreetbets/comments/l6w42a/marc_cuban_supports_wsb/,False,False,False,False,False
STOP BUYING SLV YOU SMOOTH BRAINED RETARDS ITS TECHNICALLY INVERSING GME. *I LOST MY CRAYONS SO I HAD TO USE REAL CHARTS*,75361,la4mog,https://i.redd.it/78kadx1cpve61.jpg,2690,1612190760.0,,2021-02-01 23:46:00,0.91,stockporn,wallstreetbets,/r/wallstreetbets/comments/la4mog/stop_buying_slv_you_smooth_brained_retards_its/,False,False,False,False,False
"I just bought $5,000 in $GME. I would not have done this if the brokerages didn't try to manipulate the market.",75316,l78fuh,https://www.reddit.com/r/wallstreetbets/comments/l78fuh/i_just_bought_5000_in_gme_i_would_not_have_done/,4803,1611867120.0,"I've been following /r/wallstreetbets for years. Usually just for a laugh as I am a stodgy buy and hold guy and don't speculate often. When I saw the $GME shit happening a week ago I thought it was pure stupidity and was not planning on investing. In fact, I bought some $GME puts (which I've since sold since somehow they've gone up based on volatility) betting against the crowd here.

However, what has started as a decentralized short squeeze has morphed into a class movement. I'm a big populist and think we need big changes in this country, especially a transfer of wealth and power from the elites to the people. When this morphed into a class movement I became obsessed. However, I still wasn't going to buy in because I shy away from speculating on ultra risky stuff like this. But when Robinhood and all the other major brokerages colluded to cause a massive sell off, that's when it became a matter of principle. I've watched all day as the stock has remained relatively stable on very little volume. People are holding despite wall street twisting your arm and trying to make you tap out by only allowing you to sell. It's a beautiful thing to see. I don't think of my purchase as an investment, but as putting my own skin in the game as a fuck you against a rigged system.",2021-01-29 05:52:00,0.98,ONE_GUY_ONE_JAR,wallstreetbets,/r/wallstreetbets/comments/l78fuh/i_just_bought_5000_in_gme_i_would_not_have_done/,False,False,False,False,False
Don’t know what mod gave this quote to Bloomberg... but I can get behind this message. Well done!,75186,l82vx4,https://i.redd.it/idsfqb3bxbe61.jpg,1392,1611951305.0,,2021-01-30 05:15:05,0.98,AnInterestedFellow,wallstreetbets,/r/wallstreetbets/comments/l82vx4/dont_know_what_mod_gave_this_quote_to_bloomberg/,False,False,False,False,False
How to Buy GME Above Broker Limits,75147,l82y7u,https://www.reddit.com/r/wallstreetbets/comments/l82y7u/how_to_buy_gme_above_broker_limits/,3867,1611951445.0,"How to Buy GME etc [Loophole]

Robinhood and other shitty brokerages are allowing us to buy 2, 5, or very low numbers of GME. However, they are allowing option contracts.

Here’s a trick that ~~will work.~~

**Update Feb 1 [Loophole Closed](https://www.reddit.com/r/ClassActionRobinHood/comments/la6sll/rh_blocks_exercising_of_gme_call_options/?utm_source=adioking&utm_medium=your_mom&utm_name=golden_fuckboy) **

1) Go to next nearest option expiration (Feb 5 as of today).
2) Scroll all the way down the call list.
3) Buy GME call option with the lowest +x.xx% (0% would be no premium at mark).
4) Immediately exercise.

I just exercised 2 contracts and now have 200 shares, blocking the shorts. You can repeat this process over and over if you are buying a lot.

Best of luck out there! Let’s get them!!!

P.S. ~~If you can afford 100 shares but can’t afford the risk, you can sell (heh...) some shares after you exercise and take risk off the table.~~

_Update:_ A screenshot has made it to me that Robinhood is blocking same day exercise so you would need to carry into the next trading day to exercise.

_This is NOT financial advice and is for informational purposes ONLY. You can lose 100% of anything you invest._

EDIT:

1) This works for pretty much any stock.

2) There’s a catch. You need enough money (please don’t use margin) to cover 100 shares. The way exercising works is you pay for the 100 shares at the strike price.

Example:

- $GME is $300
- The 2/5 $50c is $250 so it costs $25,000
- Cost to exercise would be $50 x 100 ($5000).
- Total cost: $30,000 (same as buying 100 shares)

After exercising you could then sell shares at open market and de-risk if you like and hold the remainder.",2021-01-30 05:17:25,0.94,adioking,wallstreetbets,/r/wallstreetbets/comments/l82y7u/how_to_buy_gme_above_broker_limits/,False,False,False,False,False
"""Give my regards to your puppet master!"" 🐙",74854,lqra7k,https://i.redd.it/60cyis2r7aj61.jpg,3143,1614109842.0,,2021-02-24 04:50:42,0.82,armchairtycoon,wallstreetbets,/r/wallstreetbets/comments/lqra7k/give_my_regards_to_your_puppet_master/,False,False,False,False,False
