title,score,id,url,comms_num,created,body,timestamp,upvote_ratio,author,subreddit,permalink,is_original_content,over_18,spoiler,locked,stickied
Where do we go from here and who is going to step up to help us?,120958,l6j4r9,https://www.reddit.com/r/wallstreetbets/comments/l6j4r9/where_do_we_go_from_here_and_who_is_going_to_step/,26990,1611794162.0,"We have grown to the kind of size we only dreamed of in the time it takes to get a bad nights sleep. We've got so many comments and submissions that we can't possibly even read them all, let alone act on them as moderators. We wrote software to do most of the moderation for us but that software isn't allowed to read the Reddit new feed fast enough and submit responses, and the admins haven't given us special access despite asking for it.

We're suffering from success and our Discord was the first casualty. You know as well as I do that if you gather 250k people in one spot someone is going to say something that makes you look bad. That room was golden and the people that run it are awesome. We blocked all bad words with a bot, which should be enough, but apparently if someone can say a bad word with weird unicode icelandic characters and someone can screenshot it you don't get to hang out with your friends anymore. Discord did us dirty and **I am not impressed with them destroying our community** instead of stepping in with the wrench we may have needed to fix things, especially after we got over 1,000 server boosts. That is pretty unethical.

To add to this, people are co-opting our name on twitter. I won't mention their accounts, but lots of handles with ""wsb"" and ""wallstreetbets"" in them are pretending to speak for us. They're saying things that we don't agree with, driving traffic to derivative communities and shitty pixelated merch stores, and generally making it harder for us to define who we are. There's also too much political bullshit in a community that was never *ever* political. The only way I want to occupy Wall St is in a suit myself or rent-free in the mind of a blown up short.

~~That is why I'm throwing my support behind the Twitter handle in general. We need a way to PUBLICLY reach out to the staff of the infrastructure that is failing us so the world can see that we aren't doing anything wrong here if they don't respond. We need to be able to respond directly to a reporter that is lying to the world about our clubhouse. We can't be expected to meet any expectations when we aren't given the tools we need.~~

~~That's not to say I approve of every message or will even be in the loop for all of them, but it's clear to me we can't do nothing and we need a megaphone.~~

~~We'll do our best not to pretend to speak for you, but to try to speak with the volume our name now seems to command to get shit done for us.~~

EDIT: As of recent developments the aforementioned twitter handle is obviously not legit anymore. Phew.",2021-01-28 09:36:02,0.92,zjz,wallstreetbets,/r/wallstreetbets/comments/l6j4r9/where_do_we_go_from_here_and_who_is_going_to_step/,False,False,False,False,False
I'm a brown woman in WSB! What the heck is this article talking about?! 😂,120742,lzqgxq,https://i.redd.it/cux6mpq7wll61.jpg,12364,1615122940.0,,2021-03-07 22:15:40,0.78,AOCnp,wallstreetbets,/r/wallstreetbets/comments/lzqgxq/im_a_brown_woman_in_wsb_what_the_heck_is_this/,False,False,False,True,False
DFV,120746,l7sjdx,https://i.redd.it/bmq1qruyw9e61.jpg,1097,1611926978.0,,2021-01-29 22:29:38,0.95,keenfeed,wallstreetbets,/r/wallstreetbets/comments/l7sjdx/dfv/,False,False,False,False,False
To the person that's the laughing stonk of their family.,117514,lerm8e,https://i.redd.it/lg01l0rph3g61.png,1327,1612720900.0,,2021-02-08 03:01:40,0.88,StuKazoo,wallstreetbets,/r/wallstreetbets/comments/lerm8e/to_the_person_thats_the_laughing_stonk_of_their/,False,False,False,False,False
Pirates of the Wall-Streetibbean,117241,ldguhp,https://i.redd.it/dyhy7cdb1qf61.jpg,1331,1612557995.0,,2021-02-06 05:46:35,0.91,TheRavinRaven,wallstreetbets,/r/wallstreetbets/comments/ldguhp/pirates_of_the_wallstreetibbean/,False,False,False,False,False
Just bought $1MM worth of $GME. My profits from years of trading. Let’s stick it to the HFs! 🦍 strong together. 💎 🙌,117152,la6w8q,https://i.redd.it/6htn6hnn5we61.jpg,5030,1612196248.0,,2021-02-02 01:17:28,0.93,tannerwastaken,wallstreetbets,/r/wallstreetbets/comments/la6w8q/just_bought_1mm_worth_of_gme_my_profits_from/,False,False,False,False,False
💎🙌 Here is our DeepFuckingValue in WSB style - art by crossdogz 🚀🚀,115635,l9dgbo,https://i.redd.it/e5g9w4xnioe61.jpg,2386,1612103767.0,,2021-01-31 23:36:07,0.91,dhiral1994,wallstreetbets,/r/wallstreetbets/comments/l9dgbo/here_is_our_deepfuckingvalue_in_wsb_style_art_by/,False,False,False,False,False
"Huge shoutout to Kevin O'Leary: ""Definition of the market is speculation. If you are short you know run a new risk that these effective social media vigilantes are going to come after you and squeeze you and its good because it will make a lot of hedge funds think for a second time before shorting.""",115356,l89alf,https://i.redd.it/yfqegtw58de61.png,3262,1611967076.0,,2021-01-30 09:37:56,0.96,GimliSagol,wallstreetbets,/r/wallstreetbets/comments/l89alf/huge_shoutout_to_kevin_oleary_definition_of_the/,False,False,False,False,False
Adopted a Gorilla.,114542,m3w2jj,https://i.redd.it/wzd4ifw16pm61.png,1900,1615598583.0,,2021-03-13 10:23:03,0.93,Pakistani_in_MURICA,wallstreetbets,/r/wallstreetbets/comments/m3w2jj/adopted_a_gorilla/,False,False,False,False,False
"Good Morning to Everyone Except Robinhood, courtesy of @KasparCMS on Twitter",114111,l8rlea,https://v.redd.it/tzn8jw52fie61,1244,1612030056.0,,2021-01-31 03:07:36,0.98,N0th1ngMatt3rs5,wallstreetbets,/r/wallstreetbets/comments/l8rlea/good_morning_to_everyone_except_robinhood/,False,False,False,False,False
"Don’t listen to them, this is them trying to take focus away from GME",112737,la09rn,https://i.redd.it/btz2rpbegue61.jpg,5581,1612175647.0,,2021-02-01 19:34:07,0.87,hsjwbksx,wallstreetbets,/r/wallstreetbets/comments/la09rn/dont_listen_to_them_this_is_them_trying_to_take/,False,False,False,False,False
RASHIDA IS WITH US,112557,l6z3e5,https://i.redd.it/90zbvwzk93e61.png,3760,1611846482.0,,2021-01-29 00:08:02,0.93,MrPostmanLookatme,wallstreetbets,/r/wallstreetbets/comments/l6z3e5/rashida_is_with_us/,False,False,False,False,False
"THIS GUY IS FLYING A BANNER SAYING ""SUCK MY NUTS ROBINHOOD""",112367,l8rlyx,https://twitter.com/kasparcms/status/1355246224207609856?s=21,1815,1612030096.0,,2021-01-31 03:08:16,0.97,fonzy541,wallstreetbets,/r/wallstreetbets/comments/l8rlyx/this_guy_is_flying_a_banner_saying_suck_my_nuts/,False,False,False,False,False
The Hero we need right now : FUCK ROBINHOOD!,111997,l6wr6s,https://i.redd.it/caa8mpqdt2e61.jpg,3413,1611841020.0,,2021-01-28 22:37:00,0.96,jordanpeterson9,wallstreetbets,/r/wallstreetbets/comments/l6wr6s/the_hero_we_need_right_now_fuck_robinhood/,False,False,False,False,False
DO NOT SELL! Robinhood has blocked the buying of more shares. If you try to sell you will get fucked because who are you going to sell it to if nobody can buy it? They are trying to make you flood the market with sales offers and bring the price down. Dont fall for it!,110406,l6wsib,https://www.reddit.com/r/wallstreetbets/comments/l6wsib/do_not_sell_robinhood_has_blocked_the_buying_of/,3927,1611841114.0,"Edit: reddit is now censoring subs it doesn't agree with like nonewnormal. Those running reddit are part of the same crooked group trying to screw us all in the GME squeeze trying to censor robinhood whistle blowers. Fuck this cucked website, I'm out!",2021-01-28 22:38:34,0.97,[deleted],wallstreetbets,/r/wallstreetbets/comments/l6wsib/do_not_sell_robinhood_has_blocked_the_buying_of/,False,False,False,False,False
My 102 year old grandmother bought GME in August 1995 and held through all this time.,110118,lavgj3,https://i.redd.it/1gy6kn7jg2f61.jpg,3237,1612272564.0,,2021-02-02 22:29:24,0.95,Lansman,wallstreetbets,/r/wallstreetbets/comments/lavgj3/my_102_year_old_grandmother_bought_gme_in_august/,False,False,False,False,False
"Inspired by many others, I hit a few GameStop’s and got some Switch’s, games, etc to donate to my local Children’s Hospital. Thanks WSB, we like the stock!",109828,meikve,https://i.redd.it/ksk24xqexlp61.jpg,1752,1616866736.0,,2021-03-28 02:38:56,0.86,RedDragons8,wallstreetbets,/r/wallstreetbets/comments/meikve/inspired_by_many_others_i_hit_a_few_gamestops_and/,False,False,False,False,False
"Give them nothing, but take from them everything",108637,l78duc,https://i.redd.it/ijenw1bmy4e61.jpg,2593,1611866995.0,,2021-01-29 05:49:55,0.96,Baalk_,wallstreetbets,/r/wallstreetbets/comments/l78duc/give_them_nothing_but_take_from_them_everything/,False,False,False,False,False
"Welcome, new money",108341,lkhsdq,https://i.redd.it/3er0gca5aoh61.jpg,2197,1613408447.0,,2021-02-16 02:00:47,0.9,fuk_normies,wallstreetbets,/r/wallstreetbets/comments/lkhsdq/welcome_new_money/,False,False,False,False,False
I asked my cat if I should buy or sell GME,108293,lu5dvw,https://v.redd.it/cer7jxne75k61,2127,1614485133.0,,2021-02-28 13:05:33,0.87,Trigger_happy_neuron,wallstreetbets,/r/wallstreetbets/comments/lu5dvw/i_asked_my_cat_if_i_should_buy_or_sell_gme/,False,False,False,False,False
DIAMOND HANDS VS THE WORLD 💎🤝💎💎SEE YALL ON THE MOON 🚀🚀🚀🚀🚀🚀🚀,108149,lammkd,https://v.redd.it/8w0e23a5jze61,2019,1612237565.0,,2021-02-02 12:46:05,0.94,_saucy_balloon,wallstreetbets,/r/wallstreetbets/comments/lammkd/diamond_hands_vs_the_world_see_yall_on_the_moon/,False,False,False,False,False
Justin Sun (Asian billionaire) has our back and is joining in.,107633,l7q26x,https://i.redd.it/8olsjgun89e61.jpg,4003,1611918801.0,,2021-01-29 20:13:21,0.9,IrishGooner77,wallstreetbets,/r/wallstreetbets/comments/l7q26x/justin_sun_asian_billionaire_has_our_back_and_is/,False,False,False,False,False
Finished my DIY project just in time for GME to 🚀🚀🚀🚀 (percentages simulated to show movement in the video),107401,lfkprt,https://v.redd.it/5gofhjblabg61,1751,1612815405.0,,2021-02-09 05:16:45,0.89,dickdemodickmarcinko,wallstreetbets,/r/wallstreetbets/comments/lfkprt/finished_my_diy_project_just_in_time_for_gme_to/,True,False,False,False,False
He said it!,107116,lmso6c,https://i.redd.it/7xf788efy9i61.jpg,1557,1613670859.0,,2021-02-19 02:54:19,0.94,TaggingSits,wallstreetbets,/r/wallstreetbets/comments/lmso6c/he_said_it/,False,False,False,False,False
CNBC now running Ads promoting that Melvin Capital closed their short positions on $GME,106395,l8539h,https://i.redd.it/8vxraurkcce61.png,7090,1611956443.0,,2021-01-30 06:40:43,0.95,jordanpeterson9,wallstreetbets,/r/wallstreetbets/comments/l8539h/cnbc_now_running_ads_promoting_that_melvin/,False,False,False,False,False
Never forget. Last year when this guy soldout the subreddit for personal gain now trying to take credit for your movement for the same reason. #cloutchaser,105257,l8pr1a,https://v.redd.it/y987vjwozhe61,5058,1612025400.0,,2021-01-31 01:50:00,0.92,bawse1,wallstreetbets,/r/wallstreetbets/comments/l8pr1a/never_forget_last_year_when_this_guy_soldout_the/,False,False,False,False,False
"Mark Cuban said ""once the brokerage stops restricting trades, then we'll see what WSB is really made of"". Well, guess what? Robinhood has removed all restrictions.",105171,lcyewd,https://www.reddit.com/r/wallstreetbets/comments/lcyewd/mark_cuban_said_once_the_brokerage_stops/,5880,1612495951.0,Let's show them what we're made of: retards.,2021-02-05 12:32:31,0.88,crispizzle,wallstreetbets,/r/wallstreetbets/comments/lcyewd/mark_cuban_said_once_the_brokerage_stops/,False,False,False,False,False
GME YOLO month-end update — Mar 2021,104796,mhektw,https://i.redd.it/2hashizm7fq61.png,3984,1617221433.0,,2021-04-01 05:10:33,0.93,DeepFuckingValue,wallstreetbets,/r/wallstreetbets/comments/mhektw/gme_yolo_monthend_update_mar_2021/,False,False,False,False,False
GME Today...,103953,m27xop,https://v.redd.it/ry01zotfi9m61,1658,1615408936.0,,2021-03-11 05:42:16,0.91,mateotrujillowheeler,wallstreetbets,/r/wallstreetbets/comments/m27xop/gme_today/,False,False,False,False,False
DEEPFUCKINGVALUE just TWEETED! HOLD THE FUCKING LINE!!!!,102825,lbsbwu,https://www.reddit.com/gallery/lbsbwu,5060,1612371970.0,,2021-02-04 02:06:10,0.89,lameparm,wallstreetbets,/r/wallstreetbets/comments/lbsbwu/deepfuckingvalue_just_tweeted_hold_the_fucking/,False,False,False,False,False
GME YOLO update — Mar 24 2021,102423,mch84i,https://i.redd.it/kv66vitpn1p61.png,5687,1616621414.0,,2021-03-25 06:30:14,0.93,DeepFuckingValue,wallstreetbets,/r/wallstreetbets/comments/mch84i/gme_yolo_update_mar_24_2021/,False,False,False,False,False
Today wasn’t a bloodbath for $GME or $AMC. WE watched LITERAL insanity as Hedgies sat and traded their trash BACK and forth to each other in order to cause YOU to panic. HOLD. BUY.,102201,lajk83,https://www.reddit.com/r/wallstreetbets/comments/lajk83/today_wasnt_a_bloodbath_for_gme_or_amc_we_watched/,5892,1612227933.0,"DD I saw posted elsewhere: hedge funds are trying their hardest to short ladder $AMC and $GME. Just hold your stock, buy more if you can afford to! 

Check out real time trade stats by googling: ""Nasdaq AMC real time trades"" and you'll see all the trade orders are 100 share volumes every millisecond. 

These are desperate hedge funds trading their stocks back and forth for a lower and lower price, driving the price down. The price drop means absolutely nothing AS LONG AS EVERYONE IS HOLDING, this will explode!

The shirts tried their damndest to drive down the share prices of both $GME and $AMC today. Specifically look at $AMC. With all that volume traded you’d expect a shitload more movement. What they got was **resistance** You could see them continuing the ladder attack after hours when YOU can’t trade. On BOTH stocks. 

The way forward is to tell them to go fuck themselves and BUY that shit up tomorrow. Let them keep punting the football back and forth to one another all day. If they can double down and play the long game SO can we. 

This is not financial advice. I’m just a retard who REALLY likes these stocks.

Edit: **LOOK AT THIS SHIT LOL** https://twitter.com/beijing_bobby/status/1356377066988564486/photo/1

Edit 2: **IF YOU’RE WONDERING IF YOU ARE DOING THE RIGHT THING WITH $AMC EL PRES KNOWS AND IS STILL HOLDING.** 
https://twitter.com/Thowe51/status/1356320431142268928?s=20",2021-02-02 10:05:33,0.92,[deleted],wallstreetbets,/r/wallstreetbets/comments/lajk83/today_wasnt_a_bloodbath_for_gme_or_amc_we_watched/,False,False,False,False,False
OUR SAVIOR KEEPS MAKING THE NEWS! DFV INSPIRES US ALL CUZ WE JUST LIKE THE STOCK! 🚀🙌🏼🐈,101623,m1a3j7,https://i.redd.it/f9077u8e41m61.jpg,2476,1615307296.0,,2021-03-10 01:28:16,0.89,No-Bandicoot-8980,wallstreetbets,/r/wallstreetbets/comments/m1a3j7/our_savior_keeps_making_the_news_dfv_inspires_us/,False,False,False,False,False
Who of my 300 brethren's are still in ?,101411,lbjgc6,https://i.redd.it/c2h5pujf88f61.png,14286,1612342486.0,,2021-02-03 17:54:46,0.9,Geko2012,wallstreetbets,/r/wallstreetbets/comments/lbjgc6/who_of_my_300_brethrens_are_still_in/,False,False,False,False,False
"When I see the media saying we use ""an offensive term for people with developmental disorders...""",101292,lnfh3v,https://j.gifs.com/q7GXrR.gif,3276,1613740177.0,,2021-02-19 22:09:37,0.79,garagetechnik,wallstreetbets,/r/wallstreetbets/comments/lnfh3v/when_i_see_the_media_saying_we_use_an_offensive/,False,False,False,False,False
APES IN CONTROL,100827,lb20ea,https://i.redd.it/pzivdqp1t3f61.png,3102,1612288865.0,,2021-02-03 03:01:05,0.92,hugh_dickinson,wallstreetbets,/r/wallstreetbets/comments/lb20ea/apes_in_control/,False,False,False,False,False
"JOSH SHAPIRO, Attorney General of Pennsylvania, is showing his support on Twitter!!!! 🚀🚀",100023,l7b321,https://i.redd.it/3hbf2bqbh5e61.jpg,1030,1611873287.0,,2021-01-29 07:34:47,0.97,[deleted],wallstreetbets,/r/wallstreetbets/comments/l7b321/josh_shapiro_attorney_general_of_pennsylvania_is/,False,False,False,False,False
"When a CNBC anchor asks, ""Is the Reddit Army going to short oil next?""",99401,lkeqb3,https://v.redd.it/g2ldstezinh61,2706,1613399337.0,,2021-02-15 23:28:57,0.9,MortalDanger00,wallstreetbets,/r/wallstreetbets/comments/lkeqb3/when_a_cnbc_anchor_asks_is_the_reddit_army_going/,True,False,False,False,False
Tried to quickly buy 50k worth of GME before close but fat fingered and ended up buying “GMED”,98756,lsgv43,https://i.redd.it/8qb3tiaquoj61.jpg,6695,1614287065.0,,2021-02-26 06:04:25,0.91,meiggs,wallstreetbets,/r/wallstreetbets/comments/lsgv43/tried_to_quickly_buy_50k_worth_of_gme_before/,False,False,False,False,False
Billionaire Investor Mark Cuban Says Reddit Stock Traders Have ‘Every Right To Kick Wall Street’s Ass’ - All Hail Wise Cuban Man!,98649,lab340,https://www.unilad.co.uk/news/billionaire-investor-mark-cuban-says-reddit-stock-traders-have-every-right-to-kick-wall-streets-ass/,1378,1612206199.0,,2021-02-02 04:03:19,0.93,superanth,wallstreetbets,/r/wallstreetbets/comments/lab340/billionaire_investor_mark_cuban_says_reddit_stock/,False,False,False,False,False
This is what holding the line looks like! Look at that volume. Diamond-Hands keep it up!,98536,laa0q9,https://i.redd.it/thafw05lrwe61.png,6210,1612203671.0,,2021-02-02 03:21:11,0.95,burninmedia,wallstreetbets,/r/wallstreetbets/comments/laa0q9/this_is_what_holding_the_line_looks_like_look_at/,False,False,False,False,False
They act like silver is so fetch,98434,la3ku2,https://i.redd.it/g4yoioifgve61.gif,2623,1612187790.0,,2021-02-01 22:56:30,0.89,PM-ME-BAKED-GOODS,wallstreetbets,/r/wallstreetbets/comments/la3ku2/they_act_like_silver_is_so_fetch/,False,False,False,False,False
CNBC Gives Billionaires A Pass But Calls For Regulation When The Little Guy Makes Money,97306,l68xm1,https://i.redd.it/lrxfqnreowd61.png,2617,1611766724.0,,2021-01-28 01:58:44,0.96,saagarenjeti,wallstreetbets,/r/wallstreetbets/comments/l68xm1/cnbc_gives_billionaires_a_pass_but_calls_for/,False,False,False,False,False
GME YOLO update — Jan 22 2021,96751,l2x7he,https://i.redd.it/xho46kzt7yc61.png,6081,1611350048.0,,2021-01-23 06:14:08,0.94,DeepFuckingValue,wallstreetbets,/r/wallstreetbets/comments/l2x7he/gme_yolo_update_jan_22_2021/,False,False,False,False,False
Apparently it’s only ok when the 1% do it.,96072,l79p8w,https://i.redd.it/nu8a03pg75e61.jpg,1021,1611869970.0,,2021-01-29 06:39:30,0.97,game_stone,wallstreetbets,/r/wallstreetbets/comments/l79p8w/apparently_its_only_ok_when_the_1_do_it/,False,False,False,False,False
"HOORAY FOR CHARLES PAYNE! “The shorts have had their way with the market for decades, and no one has ever complained about it, so i am thrilled, that individual investors are playing the same game, and now you (big hedge funds) are losing” - Charles Payne.",95709,l6popa,https://i.redd.it/nhc2rhacl0e61.jpg,1989,1611814102.0,,2021-01-28 15:08:22,0.96,Omaha_Beach,wallstreetbets,/r/wallstreetbets/comments/l6popa/hooray_for_charles_payne_the_shorts_have_had/,False,False,False,False,False
"Hang in there! To the moon? No, to the MOONSK and BEYOND!",94866,lo4qu6,https://v.redd.it/k0lsmiwt4mi61,1632,1613818338.0,,2021-02-20 19:52:18,0.85,DMmeYourCat,wallstreetbets,/r/wallstreetbets/comments/lo4qu6/hang_in_there_to_the_moon_no_to_the_moonsk_and/,True,False,False,False,False
"Congratulations, /r/wallstreetbets! You are Subreddit of the Day!",94646,l7sx8h,https://www.reddit.com/r/subredditoftheday/comments/l7swts/january_29th_2021_rwallstreetbets_to_the_moon/,1613,1611928074.0,,2021-01-29 22:47:54,0.95,verifypassword__,wallstreetbets,/r/wallstreetbets/comments/l7sx8h/congratulations_rwallstreetbets_you_are_subreddit/,False,False,False,False,False
This is us 2030,93779,l6faq4,https://i.redd.it/31a76gy74yd61.jpg,1453,1611784132.0,,2021-01-28 06:48:52,0.98,aestheticsjess,wallstreetbets,/r/wallstreetbets/comments/l6faq4/this_is_us_2030/,False,False,False,False,False
Me right now,93532,lgp6c6,https://v.redd.it/osihlhgqzlg61,1827,1612944984.0,,2021-02-10 17:16:24,0.91,zemora,wallstreetbets,/r/wallstreetbets/comments/lgp6c6/me_right_now/,False,False,False,False,False
This is just market manipulation,93126,l74kzr,https://i.redd.it/7idzskf0a4e61.png,1240,1611858735.0,,2021-01-29 03:32:15,0.98,Xonesix,wallstreetbets,/r/wallstreetbets/comments/l74kzr/this_is_just_market_manipulation/,False,False,False,False,False
"CITADEL IS THE 5TH LARGEST OWNER OF SLV, IT'S IMPERATIVE WE DO NOT ""SQUEEZE"" IT. THESE ARE HEDGE FUNDS BOTS SPAMMING AWARDS",92928,l9gv98,https://i.redd.it/iltzmggybpe61.jpg,9054,1612113618.0,,2021-02-01 02:20:18,0.84,[deleted],wallstreetbets,/r/wallstreetbets/comments/l9gv98/citadel_is_the_5th_largest_owner_of_slv_its/,False,False,False,False,False
Together no one can stop us !!!,92317,lbd21v,https://i.redd.it/3224ybp596f61.jpg,2136,1612318494.0,,2021-02-03 11:14:54,0.88,Darlink23,wallstreetbets,/r/wallstreetbets/comments/lbd21v/together_no_one_can_stop_us/,False,False,False,False,False
Bloomberg even knows: Stonks (they only go up),91697,lmpw5t,https://i.redd.it/i6bznfgkd9i61.jpg,2481,1613663843.0,,2021-02-19 00:57:23,0.95,heelhookd,wallstreetbets,/r/wallstreetbets/comments/lmpw5t/bloomberg_even_knows_stonks_they_only_go_up/,False,False,False,False,False
"Ethan Klein (h3h3 podcast) joins the battle, this is really some Avengers level stuff",91617,l7oq0j,https://i.redd.it/l4n7bnp0u8e61.jpg,1975,1611913876.0,,2021-01-29 18:51:16,0.9,jakubwlcz,wallstreetbets,/r/wallstreetbets/comments/l7oq0j/ethan_klein_h3h3_podcast_joins_the_battle_this_is/,False,False,False,False,False
Spread the word! 💎🤲,90825,l9teai,https://i.redd.it/fk8im2cz9se61.jpg,1094,1612149284.0,,2021-02-01 12:14:44,0.94,[deleted],wallstreetbets,/r/wallstreetbets/comments/l9teai/spread_the_word/,False,False,False,False,False
Putting my ad blocker to good use 💎🤲,90647,m74ca8,https://i.redd.it/hycuzfl67mn61.gif,843,1615998635.0,,2021-03-18 01:30:35,0.91,InFiveMinutes,wallstreetbets,/r/wallstreetbets/comments/m74ca8/putting_my_ad_blocker_to_good_use/,False,False,False,False,False
This money is life changing to me. I could have sold at any time and been set but these hedge funds deserve to burn. I’m holding if you all are.,90546,l81n6g,https://i.redd.it/y1h3rcszobe61.jpg,3236,1611948506.0,,2021-01-30 04:28:26,0.96,quyensanity,wallstreetbets,/r/wallstreetbets/comments/l81n6g/this_money_is_life_changing_to_me_i_could_have/,False,False,False,False,False
I’m a paper handed bitch. But my student loans are fully paid off now,89992,lef7fe,https://i.redd.it/qrqfcgkgfzf61.jpg,3280,1612671713.0,,2021-02-07 13:21:53,0.74,ProductionPlanner,wallstreetbets,/r/wallstreetbets/comments/lef7fe/im_a_paper_handed_bitch_but_my_student_loans_are/,False,False,False,False,False
BREAKING: The Ape Statue Has Arrived in Wallstreet,89927,qarb5k,https://www.reddit.com/gallery/qarb5k,1843,1634577632.0,,2021-10-19 02:20:32,0.9,VerySlump,wallstreetbets,/r/wallstreetbets/comments/qarb5k/breaking_the_ape_statue_has_arrived_in_wallstreet/,False,False,False,False,False
Hard hitting investigative journalism & pultizer prize winning stuff right here,89615,lxhxfu,https://i.redd.it/rpn6hpydszk61.jpg,1183,1614855301.0,,2021-03-04 19:55:01,0.94,MIA4real,wallstreetbets,/r/wallstreetbets/comments/lxhxfu/hard_hitting_investigative_journalism_pultizer/,False,False,False,False,False
Lets goooo!!!,89312,lbpzn4,https://i.redd.it/9zhrv49j6af61.jpg,1842,1612366078.0,,2021-02-04 00:27:58,0.88,desigenius,wallstreetbets,/r/wallstreetbets/comments/lbpzn4/lets_goooo/,True,False,False,False,False
Recovery Incoming!,89272,lowgx3,https://v.redd.it/0t13ux4zuti61,1806,1613911898.0,,2021-02-21 21:51:38,0.86,Holdmykids,wallstreetbets,/r/wallstreetbets/comments/lowgx3/recovery_incoming/,False,False,False,False,False
"If this isn't a sign, I don't know what is...🚀🚀🚀💎💎💎💎💎🤲🤲",88951,lb9vfq,https://i.redd.it/gtpngp3ag5f61.jpg,1129,1612308783.0,,2021-02-03 08:33:03,0.93,furkix,wallstreetbets,/r/wallstreetbets/comments/lb9vfq/if_this_isnt_a_sign_i_dont_know_what_is/,False,False,False,False,False
Tis a fine day to like the stock,88308,l7e1yq,https://v.redd.it/vya2hpqr26e61,966,1611880611.0,,2021-01-29 09:36:51,0.98,WhiteningMcClean,wallstreetbets,/r/wallstreetbets/comments/l7e1yq/tis_a_fine_day_to_like_the_stock/,False,False,False,False,False
If this isn’t a sign from God himself,87875,lnuffj,https://i.redd.it/mwngf5gdzii61.jpg,2146,1613780138.0,,2021-02-20 09:15:38,0.91,everettglovier,wallstreetbets,/r/wallstreetbets/comments/lnuffj/if_this_isnt_a_sign_from_god_himself/,False,False,False,False,False
Eating a ghost pepper because I'm an ape of my word,87735,m3mipi,https://v.redd.it/wi6in8zhsmm61,3651,1615570195.0,,2021-03-13 02:29:55,0.87,EastCoastTaffy,wallstreetbets,/r/wallstreetbets/comments/m3mipi/eating_a_ghost_pepper_because_im_an_ape_of_my_word/,False,False,False,False,False
GME YOLO update — Apr 1 2021,87668,mi9hdf,https://i.redd.it/qs5f2oeisnq61.png,2685,1617325227.0,,2021-04-02 10:00:27,0.96,DeepFuckingValue,wallstreetbets,/r/wallstreetbets/comments/mi9hdf/gme_yolo_update_apr_1_2021/,False,False,False,False,False
GME YOLO update — Jan 25 2021,87581,l4xje1,https://i.redd.it/1ubfvqedmjd61.png,5316,1611608736.0,,2021-01-26 06:05:36,0.95,DeepFuckingValue,wallstreetbets,/r/wallstreetbets/comments/l4xje1/gme_yolo_update_jan_25_2021/,False,False,False,False,False
Catch me if you can,87290,rqo284,https://i.redd.it/lyfe4efr8c881.jpg,1903,1640721125.0,,2021-12-29 04:52:05,0.94,eyerollingsex,wallstreetbets,/r/wallstreetbets/comments/rqo284/catch_me_if_you_can/,False,False,False,False,False
