title,score,id,url,comms_num,created,body,timestamp,upvote_ratio,author,subreddit,permalink,is_original_content,over_18,spoiler,locked,stickied
Porn addict hasn’t masturbated in 54 days and $GME is breaking his will,87193,lb02kr,https://i.redd.it/xqaz60x5f3f61.jpg,1939,1612284193.0,,2021-02-03 01:43:13,0.94,WalyWal,wallstreetbets,/r/wallstreetbets/comments/lb02kr/porn_addict_hasnt_masturbated_in_54_days_and_gme/,False,False,False,False,False
First AOC and now Ben Shapiro? This is true unity.,87177,l6zmxb,https://i.redd.it/ai10opxxc3e61.jpg,1783,1611847598.0,,2021-01-29 00:26:38,0.96,[deleted],wallstreetbets,/r/wallstreetbets/comments/l6zmxb/first_aoc_and_now_ben_shapiro_this_is_true_unity/,False,False,False,False,False
Why am I still holding? I'm an Apeman.,87130,mxe7dz,https://v.redd.it/mu838r04f2v61,2345,1619245676.0,,2021-04-24 15:27:56,0.86,Dotton_Creative,wallstreetbets,/r/wallstreetbets/comments/mxe7dz/why_am_i_still_holding_im_an_apeman/,True,False,False,False,False
"Can you say ""CLASS ACTION LAWSUIT"". Fuck you RobinHood",86776,l6wbbj,https://www.reddit.com/r/wallstreetbets/comments/l6wbbj/can_you_say_class_action_lawsuit_fuck_you/,3821,1611839803.0,"Edit 6: I created r/ClassActionRobinHood for people to gather around so that my reddit won't crash under the sheer force of autism that my inbox is receiving. This post was just out of frustration and memes over RHs bullshit corruption; I am not a laywer nor am I claiming that i'm going to create a class action by creating this post. You retards do as you wish, feel free to join if you want. Hell, use it as a backup in case something happens to WSB, I don't give a fuck

Edit: Stop giving me these beautiful awards you retards, use the money on GME. 

This is the way. 💎🙌💎. GME GANG FOREVER 🚀🚀🚀🚀🚀🚀🚀🚀🚀🚀🚀🚀🚀🚀🚀🚀🚀🚀🚀 STRAIGHT TO THE Nth DIMENSION BOYS 🚀🚀🚀🚀🚀🚀

Edit 2: I will be acquiring more shares today. I have 17.7k liquid money in my TD. Bought 15 shares @327. Waiting for another dip to yolo 12.7k into the rest. I have 18 shares holding on RH with average cost of $112. 1000EOD Boys. Fuck the shorts, fuck the establishment. Melvin and friends can suck my fat diamond encrusted cock. Don't forget to leave RH a nice review on the app store thanking them for your gains

Edit 3: I convinced my mother to yolo her stocks into GME early on @90. She still continues to add onto it and as of now she holds 147+ shares and is profiting well over 60k. I don't know what her cost average currently sits at but if my mother can 💎🙌💎 then so can you. She's more diamond-handed than me. Do your part brothers. We'll all be feasting on tendies from our golden plates and washing it down with Shitron tears as we wipe our asses with Melvin bucks by end of next week.

Edit 4: I can't believe how much this is blowing up. I wasn't expecting it. But while I have the spotlight, I just wanted to thank every single one of you from the bottom of my heart. You tards have done absolute wonders for the community and started a financial revolution fueled by memes and autism.
 I read all these stories about how this community has helped people pay off their debts, care for sick loved ones, allowed people to give back to their local communities, and so much more. You guys are the true unsung heroes of this generation and are some of the most wholesome degenerates i've ever seen. This fight isn't about just tendies anymore, its about justice and equality, it's about sticking it to the corporate elites who run the world. Don't let these greedy scumbags take what's rightfully yours, for too long the little guy has been pushed and shoved around but now it's our time to shine. Keep up the good fight and don't back down. 💎🙌💎 for days boys, WE WILL NOT STOP UNTIL WE SEE ELON SHOOT A GME THEMED ROCKET FILLED WITH THE BURNT ASHES OF THESE BASTARDS TO MARS. FUCK SHORTS. THIS ONE IS FOR THE HISTORY BOOKS! 🚀🚀🚀🚀🚀🚀🚀🚀🚀🚀🚀🚀🚀🚀🚀 GME 5,000 IS NOT A MEME NOW. POWER TO THE PLAYERS!

EDIT 5: Stop spamming me with awards and upvotes, you retards are crashing my inbox! Put forth all this glorious energy into GME.




TL;DR: GME to 1,000 EOD, GME 5000 EONW. THE SUQEEZE HAS NOT SQUOZEN YET, BUY AND HOLD 💎🙌💎🚀🚀🚀🚀🚀🚀🚀🚀",2021-01-28 22:16:43,0.97,sable428,wallstreetbets,/r/wallstreetbets/comments/l6wbbj/can_you_say_class_action_lawsuit_fuck_you/,False,False,False,False,False
Don’t be scared by the drop in $BB $GME etc. Hedge Funds trade after hours to scare y’all off... KEEP BUYING AND HOLDING 🚀🚀,86566,l6sttu,https://i.redd.it/a0to0qe4n1e61.jpg,4325,1611826808.0,,2021-01-28 18:40:08,0.94,ShortVIXDaily,wallstreetbets,/r/wallstreetbets/comments/l6sttu/dont_be_scared_by_the_drop_in_bb_gme_etc_hedge/,False,False,False,False,False
Looking at my accounts in the morning,86525,lymdsh,https://i.redd.it/ac69b8ql1al61.gif,1061,1614979782.0,,2021-03-06 06:29:42,0.94,Craneteam,wallstreetbets,/r/wallstreetbets/comments/lymdsh/looking_at_my_accounts_in_the_morning/,False,False,False,False,False
I suspect the hedgies are illegally covering their short positions,86485,lalucf,https://www.reddit.com/r/wallstreetbets/comments/lalucf/i_suspect_the_hedgies_are_illegally_covering/,3473,1612234985.0,"TLDR; **Melvin and gang hasn't covered shit. They've been illegally ""closing out"" their short positions and if we hold they will 100% get fucked. There is far more nefarious shit at play.**

So this morning I saw the S3 and Ortex data both report significant covering of short positions for GME. This absolutely threw me for a loop because Friday morning they reported above ~120% short interest still. I could not for the life of me figure out how someone could close >50% of short positions on such a tightly held stock in ONE day with very little trading volume in the week. This got me digging around to figure out what's up.

I started by looking into GME failed to delivers (i.e. short sellers not able to cover their position on a stock) for the first half of January and I was shocked to find that just in the first 15 days of Jan, GME had ~1.2 MILLION failed to delivers. This is before most of wsb or mainstream began buying.

What was interesting though, is that of that ~1.2million, ~700K shares were covered in chunks throughout the two week period. I dug further back into the SEC failed to deliver reports for GME and saw that pattern extending back months. It seemed almost as if the short positions were just being kicked down the road.

Having spent some time looking at the pattern, it's clear a large amount of failed to delivers come in, then a small chunk of coverage, then another large amount, and so on. To me this looked shady af so I looking into reasons that could cause that and discovered this article: https://www.sec.gov/about/offices/ocie/options-trading-risk-alert.pdf

In it, a specific section is eerily similar to what we've experienced with GME:

""Assuming that XYZ (e.g. GME) is a hard to borrow security (e.g. apes holding strong), and that Trader A (Melvin), or its broker-dealer, is unable (apes again) to borrow shares to make delivery on the short sale of actual shares, the short sale may result in a fail to deliver position at Trader A’s clearing firm. Rather than paying the borrowing fee on the shares to make delivery, or unwinding the position by purchasing the shares in the market, Trader A might next enter into a trade that gives the appearance of satisfying the broker-dealer’s close-out requirement, but in reality allows Trader A to maintain its short position without ever delivering on the short sale. Most often, this is done through the use of a buy-write trade, but may also be done as a married put and may incorporate the use of short term FLEX options. These trades are commonly referred to as “reset transactions,” in that they have the effect of resetting the time that the broker-dealer must purchase or borrow the stock to close-out a fail. The transactions could be designed solely to give the appearance of delivering the shares, when in reality the trader has no intention of meeting his delivery obligations. Such transactions were alleged by the Commission to be sham transactions in recent enforcement cases. Such transactions between traders or any market participants have also been found to constitute a violation of a clearing firm’s responsibility to close out a failure to deliver.""

It's almost like a play by play of what we've seen (in combination with the ladder attacks). My guess is we'll find out more when the failed to deliver report for the second half of Jan comes out on the 17th.

I 100% think that Melvin is committing massive securities fraud. In fact, I would bet all my money on it - oh wait, I did 96 GME @ 290.

I am now holding on principle to see these fucks fail.

More DD: https://www.reddit.com/user/bcRIPster/comments/labq6u/follow_the_crumbs_gme_exposed_the_meta https://www.sec.gov/data/foiadocsfailsdatahtm

Not a financial adviser, I eat paint chips for dinner

EDIT: Ok, so I've been reading some comments and I wanted to clear a couple things up:

* The failed to deliver number is reported cumulatively. So if you sum everything for the Jan time period it'd come out incorrectly as 5 million. What I'm doing is summing all the *debits* to get an aggregate view of all the failed to delivers in the time range. This process is validated and discussed in other /r/wsb posts

* I know ETF's could have been redeemed by some MM's to gather up GME stock. However I'm not convinced there is enough GME held in ETF's to be a significant factor. Someone in the comments reported this amount to be about ~10M. We would know if a bunch of ETF's rebalanced and dumped GME.

* My number for the Ortex short interest was incorrect, I got mixed around when I wrote this initially. The short interest reported by Ortex on Friday morning was ~80%. The 120 figure for S3 was correct. 

* Please checkout the linked DD - it goes into much more detail and covers things far better than I can. 

* Share this post and the related DD. We need to hold wall street accountable if this is true and I think that starts by spreading the word. 

* I'm going to continue to dig into this tonight / tomorrow. Look forward to a new post tomorrow evening.


If I take an L to 0, I take an L to 0. I don't invest what I can't lose. But you can bet your ass I'll be holding till this blows open.

WE LIKE THE STOCK 💎🖐️",2021-02-02 12:03:05,0.93,DeeJay_Roomba,wallstreetbets,/r/wallstreetbets/comments/lalucf/i_suspect_the_hedgies_are_illegally_covering/,False,False,False,False,False
Vlad got impaled,86376,l7dt3n,https://i.redd.it/cml1r5f716e61.jpg,2573,1611879979.0,,2021-01-29 09:26:19,0.97,MIA4real,wallstreetbets,/r/wallstreetbets/comments/l7dt3n/vlad_got_impaled/,False,False,False,False,False
"Whistleblowers are coming out, it’s happening man.",86281,l77qhk,https://i.redd.it/cdhi2aibu4e61.jpg,1807,1611865559.0,,2021-01-29 05:25:59,0.97,game_stone,wallstreetbets,/r/wallstreetbets/comments/l77qhk/whistleblowers_are_coming_out_its_happening_man/,False,False,False,False,False
Retard and his cat resting before they bankrupt some HFs,86207,md8nsz,https://i.redd.it/x6fx0bg8q8p61.png,1402,1616707007.0,,2021-03-26 06:16:47,0.83,simzyk,wallstreetbets,/r/wallstreetbets/comments/md8nsz/retard_and_his_cat_resting_before_they_bankrupt/,False,False,False,False,False
LET THE PEOPLE TRADE!,86192,l73jxk,https://i.redd.it/rqmammg914e61.jpg,1544,1611855803.0,,2021-01-29 02:43:23,0.96,chopper0755,wallstreetbets,/r/wallstreetbets/comments/l73jxk/let_the_people_trade/,False,False,False,False,False
Whats it's like checking in on WSB this weekend,86030,m523qq,https://i.redd.it/n88jg3dqo1n61.gif,762,1615750003.0,,2021-03-15 04:26:43,0.91,themagestikarp,wallstreetbets,/r/wallstreetbets/comments/m523qq/whats_its_like_checking_in_on_wsb_this_weekend/,False,False,False,False,False
There is no silver short squeeze happening. NONE. NEVER.,86022,la1o04,https://www.reddit.com/r/wallstreetbets/comments/la1o04/there_is_no_silver_short_squeeze_happening_none/,2013,1612181291.0,"Silver might go up nicely and for a time but don't get high on hopium, this is not gonna go in the 100s.

https://twitter.com/michaeljburry/status/1356111612759789568

>A corner in the silver market has been tried before - and let's be clear, that is what is being attempted now.  In 1980, a rule change by the government destroyed the corner.  #silverthursday.

https://www.britannica.com/topic/Silver-Thursday

>Silver Thursday, the dramatic fall in the price of silver on March 27, 1980, following the Hunt brothers’ attempt to corner the market on the metal.

-
>Apart from a handful of reigning monarchs and despots, Nelson Bunker Hunt (1926–2014) was the richest man in the world at the start of the 1960s. Like his father, the legendary oilman H. L. Hunt, Bunker gambled big and got lucky. By 1970, although his wealth was accumulating faster than he could spend it, he foresaw a volatile economic future. Prevented by Franklin Roosevelt’s 1933 prohibition on U.S. citizens owning gold, Bunker and his younger brother William Herbert (b. 1929) chose silver, then standing at $1.50 per ounce, as their speculative hedge. Their initial caution vanished after Colonel Muammar al-Qaddafi nationalized the Bunkers’ Libyan oil fields in 1973. Furious, and paranoid that paper money would soon be worthless, the Hunt brothers then bought futures contracts on 55 million ounces of silver, eventually accumulating an estimated 100 million ounces of the precious metal. But instead of selling the contracts like normal commodity traders, they took delivery of the bullion and chartered three Boeing 707s to air-freight it to Switzerland.

-
>By 1979, they had engineered a genuine shortage of the metal. The Hunts owned $4.5 billion-worth of shiny, glittering silver, safely stashed in Swiss vaults. Still the price climbed, until on January 17, 1980, an ounce cost $49.45. Such rampant speculation and profits triggered new government oversight, prompting the Federal Reserve to suspend trading in silver. The boom was suddenly over, but the Hunts still had to honour contracts to buy at prices over $50. The day the market plunged—March 27—silver fell to $10.80, the metal’s biggest single collapse. Upon losing some $1.7 billion, prompting Bunker to quip, “A billion dollars isn’t what it used to be,” the Hunts had become the (then) greatest debtors in financial history, and though New York banks allowed them $1.1 billion credit towards clearing their obligations, they were personally bankrupted and later convicted of illegally trying to corner the market on the precious metal; the brothers were fined $10 million each, in addition to the millions they owed to the IRS, and banned from future trading on the commodities market. The Hunts had gambled that silver was undervalued, but they failed because they had made the price of silver too attractive for its own good.

-
>To pay off his staggering debt, Bunker was forced to sell off his beloved stable of thoroughbred horses, three of whom were named Extravagant, Goofed, and Overdrawn. William Herbert remained a billionaire into the 21st century. The character of J. R. Ewing in the original TV series Dallas (1978–91) and the Duke Brothers in the movie Trading Places (1983) all drew inspiration from the Hunt family and their larger-than-life careers and personalities.",2021-02-01 21:08:11,0.9,MarioBuzo,wallstreetbets,/r/wallstreetbets/comments/la1o04/there_is_no_silver_short_squeeze_happening_none/,False,False,False,False,False
Just bought my first home. Thank you Wallstreetbets!,85596,or1j43,https://i.redd.it/1u9kjiyh79d71.jpg,1210,1627173091.0,,2021-07-25 09:31:31,0.87,CUM-CEO,wallstreetbets,/r/wallstreetbets/comments/or1j43/just_bought_my_first_home_thank_you_wallstreetbets/,False,False,False,False,False
Collage of billboards purchased by you beautiful apes.,85532,lbtj6o,https://i.redd.it/m7vewn5fwaf61.png,1205,1612374904.0,,2021-02-04 02:55:04,0.93,omegamullet,wallstreetbets,/r/wallstreetbets/comments/lbtj6o/collage_of_billboards_purchased_by_you_beautiful/,False,False,False,False,False
GME Overnight Pajama Party Megathread,85526,l7iorh,https://www.reddit.com/r/wallstreetbets/comments/l7iorh/gme_overnight_pajama_party_megathread/,76509,1611893142.0,"Yo, health check time:

- Get proper sleep
- Eat proper food
- Stretch occasionally
- 💦 HYDRATE 💦


I'm sure we've all been glued to our screens all week, but please make sure you take care of yourselves.

If you promise to do a good job, we can take turns piloting the rockets 🚀🚀🚀",2021-01-29 13:05:42,0.94,wallstreetboyfriend,wallstreetbets,/r/wallstreetbets/comments/l7iorh/gme_overnight_pajama_party_megathread/,False,False,False,True,False
Robinhood staff unhappy about the trading hault were paid off... With a $40 Doordash credit lmfao.,85487,l7y5ka,https://i.redd.it/kd81m6d91be61.jpg,2223,1611940645.0,,2021-01-30 02:17:25,0.97,ddplz,wallstreetbets,/r/wallstreetbets/comments/l7y5ka/robinhood_staff_unhappy_about_the_trading_hault/,False,False,False,False,False
WE are Preparing a Class Action LAWSUIT against Robinhood!,85444,l6yrs3,https://www.reddit.com/r/wallstreetbets/comments/l6yrs3/we_are_preparing_a_class_action_lawsuit_against/,20702,1611845865.0,"Hey everyone,

&#x200B;

We all just got screwed by Robinhood's screwup here. I'm friends with a lawyer who says we have a good case for a class action lawsuit.

&#x200B;

Everyone comment here if you have/had shares or calls in GME held in Robinhood at market open today.

&#x200B;

Let's show these guys the system can't fuck with us!

&#x200B;

Edit:

Everyone take screenshots of Robinhood's app saying you can't buy, or blocking your orders.

Edit the 2nd:

Wheeeew lads let's get on it! I'll go through all these pms and comments this afternoon with my lawyer friend. Keep em coming!

And please share!

Edit 3:

OMFG guys I'm getting 1000s of PMs! It'll take a while to sort through them all and reply, but keep messaging and sharing! Also if you were using WeBull or some other brokerage and got blocked, you might as well join too.

\_\_\_\_\_\_\_\_\_\_\_\_\_\_\_\_\_\_\_\_\_\_\_\_\_\_\_\_\_\_\_\_\_\_\_\_\_\_\_\_\_\_\_\_\_\_\_\_\_\_\_\_\_\_\_\_\_\_\_\_\_\_\_\_\_\_\_\_\_\_\_\_\_\_\_\_\_\_\_\_\_\_\_\_\_\_\_\_\_\_\_\_\_\_\_\_\_\_\_\_\_\_

Edit 4:

My team and the lawyers had a conference call, and it's on!

We'll have an update in the next 48 hours with the procedures and next steps.

If you have any questions or concerns, please PM me and I'll try to get through as many as I can once we have more details.

Edit 1/30:

Work is ongoing. Sorry for the lack of news, the lawyers are still getting their ducks in a row. I'll update with more info as soon as it's available.

2/2 Update:

Just to let everyone know where we're at, my team is currently doing the research and building the case. This is a pretty huge lift though, so we're getting people on the team with the expertise needed to give us the best chance of success. It's taking time to get the most qualified people possible, but I want to do this the right way. I hope to have another update with good news in the near future. Thanks for all of the support and encouragement!

PS, sorry guys but I literally can't open my Chats now. Probably has something to do with the 8.9k next to it.... If you need to reach me you can send a Message, or leave a comment and tag my username. 

2/11:
Update: please see the [new survey here.](https://forms.gle/mPLrq329wUDboAdE8)",2021-01-28 23:57:45,0.98,Shrubber,wallstreetbets,/r/wallstreetbets/comments/l6yrs3/we_are_preparing_a_class_action_lawsuit_against/,False,False,False,False,False
Truth!,85119,rsj0t6,https://i.redd.it/mnnnaryrgs881.jpg,1323,1640917531.0,,2021-12-31 11:25:31,0.91,cuki321,wallstreetbets,/r/wallstreetbets/comments/rsj0t6/truth/,False,False,False,False,False
CNBC is really not holding back I see,85070,ln5iae,https://i.redd.it/a7sc4l32tci61.jpg,1195,1613705372.0,,2021-02-19 12:29:32,0.9,CappedCrib,wallstreetbets,/r/wallstreetbets/comments/ln5iae/cnbc_is_really_not_holding_back_i_see/,False,False,False,False,False
THE ECONOMY EXPLAINED,84726,lswef6,https://v.redd.it/5kcsd2xbatj61,2876,1614341088.0,,2021-02-26 21:04:48,0.89,xXxNOBELxXx,wallstreetbets,/r/wallstreetbets/comments/lswef6/the_economy_explained/,False,False,False,False,False
Lose enough money with Fidelity and they'll send you a letter perfect for framing,84360,lxe2pv,https://i.redd.it/yw6rwjlmcyk61.png,2570,1614837926.0,,2021-03-04 15:05:26,0.95,djpyro,wallstreetbets,/r/wallstreetbets/comments/lxe2pv/lose_enough_money_with_fidelity_and_theyll_send/,False,False,False,False,False
"GME up 37% ""I'm not sure I can take it again""",84195,lrmrsc,https://v.redd.it/a1kqnxvckhj61,6030,1614198899.0,,2021-02-25 05:34:59,0.92,arnhuld,wallstreetbets,/r/wallstreetbets/comments/lrmrsc/gme_up_37_im_not_sure_i_can_take_it_again/,False,False,False,False,False
Citadel reloaded their shorts before they told Robinhood to stop trading $GME,84032,l747eg,https://twitter.com/justinkan/status/1354853920762253315?s=21,3561,1611857436.0,,2021-01-29 03:10:36,0.97,synaesthesisx,wallstreetbets,/r/wallstreetbets/comments/l747eg/citadel_reloaded_their_shorts_before_they_told/,False,False,False,False,False
I converted the price of GME to sound and could not believe my ears,83921,lsu313,https://v.redd.it/z27ydrc3jsj61,1651,1614331593.0,,2021-02-26 18:26:33,0.85,icontact2011,wallstreetbets,/r/wallstreetbets/comments/lsu313/i_converted_the_price_of_gme_to_sound_and_could/,False,False,False,False,False
They are selling millions of shares from ETFs that’s why it’s dipping,83906,ls8dka,https://www.reddit.com/r/wallstreetbets/comments/ls8dka/they_are_selling_millions_of_shares_from_etfs/,4918,1614265124.0,"Full Credit to u/HeyItsPixeL one of the best DDs I’ve ever read

GUYS HOLD I CANT STRESS THIS ENOUGH

(9:51AM): THEY ARE SHORTING $GME VIA 63(!) DIFFERENT ETFS**

**EDIT2 (10AM): 0 SHORTS AVAILABLE FOR $GME RIGHT NOW. THEY BORROWED OVER 2,100,000 SHARES TO SHORT FOR YESTERDAY AND TODAY**! ([https://fintel.io/ss/us/gme](https://fintel.io/ss/us/gme);  [https://iborrowdesk.com/report/GME](https://iborrowdesk.com/report/GME))

**IMPORTANT EDIT(5)(10:41AM):**  CBOE Volatility Index (VIX) ROSE 10 % AND THE WHOLE MARKET IS TAKING DIPS RIGHT NOW. That's exactly what happened back in January in the first Gamma Squeeze. Good sign!

&amp;#x200B;

THE BIGGEST ONES:

ETF 1: [https://iborrowdesk.com/report/VIOV](https://iborrowdesk.com/report/VIOV) \- 15.000 SHARES SOLD SHORT

ETF 2: [https://iborrowdesk.com/report/RWJ](https://iborrowdesk.com/report/RWJ) \- 4.500 SHARES SOLD SHORT

ETF 3: [https://iborrowdesk.com/report/XRT](https://iborrowdesk.com/report/XRT) \- **450.000** SHARES SOLD SHORT

ETF 4: [https://iborrowdesk.com/report/VIOG](https://iborrowdesk.com/report/VIOG) \- 6.000 SHARES SOLD SHORT

ETF 5: [https://iborrowdesk.com/report/IJR](https://iborrowdesk.com/report/IJR) \- **350,000** SHARES SOLD SHORT (Thanks to u/ [JoeCitizen1984](https://www.reddit.com/user/JoeCitizen1984)  for the find!)

EDIT6:  **XRT GME holdings increased from 3% testerday to 9% today. XRT IS ALMOST 200 % SHORT SOLD ATM** ([https://www.etfchannel.com/symbol/xrt/](https://www.etfchannel.com/symbol/xrt/))

EDIT7(12:21AM): CBOE Volatility Index (VIX) ROSE 16 % AND THE WHOLE MARKET IS TAKING DIPS RIGHT NOW. That's exactly what happened back in January in the first Gamma Squeeze. Good sign!

EDIT8(13:43AM): CBOE Volatility Index (VIX) ROSE 25 %!!!!! Also: TECH Stocks are in deep red again. Propably Hedgefunds sellings other assets to prepare for a huge buy of GME.

EDIT10(2:45PM): I added up all of the shorts at the opening! 18,363,000 (18 Million, yes!) Shares were sold short at the beginning of the market. The Hedgies are fucked.

EDIT11(3:30PM): CBOE Volatility Index (VIX) ROSE 40 %!

&amp;#x200B;

Here are the ones they are using as well:

* VTWV
* VCR
* IUSS
* VTWO
* EWSC
* PSCD
* SFYF
* SYLD
* RALS
* FNDB
* VBR
* IJS
* NUSC
* SLYV
* SPSM
* SLY
* FLQS
* IJT
* GSSC
* SLYG
* VXF
* NVQ
* VB
* SAA
* BBSC
* OMFS
* STSB
* SSLY
* SCHA
* PBSM
* UWM
* VTHR
* TILT
* SPDR
* HDG
* AVUS
* DFAU

&amp;#x200B;

Also: **They borrowed 1,500,000** $GME Shares **to short yesterday (**[**https://iborrowdesk.com/report/GME**](https://iborrowdesk.com/report/GME)**)**, but there was no huge drop off or sell volume that would indicate, that they already shorted those. That means, they are now using those shorts as well as the ETFs.

&amp;#x200B;

TL;DR: Millions of shares being sold short today, trying to get people to panic sell. DATA IS FROM 9:45AM.

Edit: Holy shit guys thanks for the support make all of WSB see this

Credit to u/HeyItsPixeL",2021-02-25 23:58:44,0.9,mattl1028,wallstreetbets,/r/wallstreetbets/comments/ls8dka/they_are_selling_millions_of_shares_from_etfs/,False,False,False,False,False
Everyone on WSB when they see u/DeepFuckingValue during the hearing.,83043,lmupc7,https://v.redd.it/qsfwatrwcai61,894,1613675864.0,,2021-02-19 04:17:44,0.92,imperba,wallstreetbets,/r/wallstreetbets/comments/lmupc7/everyone_on_wsb_when_they_see_udeepfuckingvalue/,False,False,False,False,False
Honorary WSB Autist award goes to Chamath Palihapitiya! He is out here defending us retail investors and calling out hedge funds for their manipulation and bullshit practices that have left retail holding the bag for YEARS. GME going🚀🚀🚀🚀🚀🚀,83019,l69jz5,https://i.redd.it/rty35qamswd61.png,2582,1611768192.0,,2021-01-28 02:23:12,0.96,[deleted],wallstreetbets,/r/wallstreetbets/comments/l69jz5/honorary_wsb_autist_award_goes_to_chamath/,False,False,False,False,False
